norm_name,Item Name,アイテム名,ID,効果,クオリティ,Damage Up,Tears Up,Speed Up,Shotspeed,DLC,種類
A_Pony,A Pony,,5.100.130,"Passively gives flight and increases speed to 1.5 whether or not it has charges. Upon use, Isaac charges in the direction the pony is facing, giving invincibility during the charge and dealing 40 damage.
Now deals 4 times Isaac's damage, plus a flat 28 damage.",2,,,,,Rebirth,アクティブ
Anarchist_Cookbook,Anarchist Cookbook,,5.100.65,Spawns six Troll Bombs around the room.,1,,,,,Rebirth,アクティブ
Best_Friend,Best Friend,,5.100.136,"Spawns a decoy Isaac that explodes after 5 seconds, dealing 110 185 damage. Enemies will always target the decoy and ignore Isaac.",1,,,,,Rebirth,アクティブ
Blank_Card,Blank Card,,5.100.286,"Copies the effect of the card or rune currently held by Isaac.
No longer copies the effects of runes.",2,,,,,Rebirth,アクティブ
Blood_Rights,Blood Rights,,5.100.186,"Upon use, takes a full heart of health and deals 40 damage to all enemies in the room.",0,,,,,Rebirth,アクティブ
Bob%27s_Rotten_Head,Bob's Rotten Head,,5.100.42,"Upon use, Isaac holds a poison bomb which can be thrown in the cardinal directions and explodes on impact.",1,,,,,Rebirth,アクティブ
Book_of_Revelations,Book of Revelations,,5.100.78,"Gives one Soul Heart, increases the chance for a Devil Room or Angel Room to appear after defeating the floor's boss, and sometimes/ always replaces the boss of the current floor with a Harbinger if possible.",3,,,,,Rebirth,アクティブ
Book_of_Secrets,Book of Secrets,,5.100.287,"Gives the effect of Treasure Map, The Compass, or Blue Map for the duration of the current floor.",0,,,,,Rebirth,アクティブ
Book_of_Shadows,Book of Shadows,,5.100.58,"Creates a protective shield, nullifying all types of damage in the current room for 10 seconds.",3,,,,,Rebirth,アクティブ
Box_of_Spiders,Box of Spiders,,5.100.288,"Spawns 1-4 Blue Spiders that deal 2.5x damage to enemies.
Spawns 4-8 Blue Spiders that deal 2x damage to enemies.",1,,,,,Rebirth,アクティブ
Breath_of_Life,Breath of Life,,5.100.326,"Grants a brief moment of invincibility when the charge bar hits zero. If the spacebar is held for an additional second after hitting zero, Isaac will take damage.",0,,,,,Rebirth,アクティブ
Butter_Bean,Butter Bean,,5.100.294,"Upon use, Isaac farts and knocks back nearby enemies and projectiles. Enemies pushed into walls or obstacles take 12 damage.",1,,,,,Rebirth,アクティブ
Converter,Converter,,5.100.296,Converts two one Soul Heart(s) or Black Heart(s) into one filled Red Heart Container.,2,,,,,Rebirth,アクティブ
Crack_the_Sky,Crack the Sky,,5.100.160,"Summons 5 beams of light in random locations on the ground, dealing large amounts of damage to any enemies that touch them.",2,,,,,Rebirth,アクティブ
Crystal_Ball,Crystal Ball,,5.100.158,"Upon use, reveals the map (except the Super Secret Room) and drops a Soul Heart or random card/rune.",3,,,,,Rebirth,アクティブ
D10,D10,,5.100.285,Re-rolls all monsters in the room. Will attempt to re-roll monsters into ones with a similar amount of HP.,0,,,,,Rebirth,アクティブ
D100,D100,,5.100.283,"Combines the effects of D4, The D6, and D20.
Combines the effects of D1, D4, The D6, D7, D8, D10, D12, and D20.",3,,,,,Rebirth,アクティブ
D20,D20,,5.100.166,Rerolls all pickups in the current room.,2,,,,,Rebirth,アクティブ
D4,D4,,5.100.284,Rerolls all of Isaac's passive items.,3,,,,,Rebirth,アクティブ
Dad%27s_Key,Dad's Key,,5.100.175,"Upon activation, opens all doors in the current room in almost all circumstances, including doors which require a Key to open, entrances to Secret Rooms, and the door to Mega Satan.",1,,,,,Rebirth,アクティブ
Dead_Sea_Scrolls,Dead Sea Scrolls,,5.100.124,Triggers the effect of a random activated item from a list of possible options (not every activated item is included).,1,,,,,Rebirth,アクティブ
Deck_of_Cards,Deck of Cards,,5.100.85,Gives Isaac a random card.,2,,,,,Rebirth,アクティブ
Doctor%27s_Remote,Doctor's Remote,,5.100.47,"Creates a crosshair on the ground that can be aimed with tear controls. A missile strikes the spot after 2 seconds, creating a heavy damage explosion.",1,,,,,Rebirth,アクティブ
Flush!,Flush!,,5.100.291,Turns all non-boss monsters in the room into poop. Instantly kills poop-themed bosses.,1,,,,,Rebirth,アクティブ
Forget_Me_Now,Forget Me Now,,5.100.127,"On use, re-generates the current floor with a new layout. Isaac loses Forget Me Now, but keeps other items and consumables picked up on the original floor.",3,,,,,Rebirth,アクティブ
Guppy%27s_Head,Guppy's Head,,5.100.145,Spawns 2-4 friendly Blue Flies that damage enemies.,3,,,,,Rebirth,アクティブ
Guppy%27s_Paw,Guppy's Paw,,5.100.133,"Upon use, converts one Red Heart Container into three Soul Hearts.",3,,,,,Rebirth,アクティブ
Head_of_Krampus,Head of Krampus,,5.100.293,"Fires a powerful Brimstone beam in four cardinal directions, much like Krampus shoots.
Fires a powerful Brimstone beam in four cardinal directions, much like Krampus shoots with a 50% chance to rotate all beams around Isaac 90 degrees.",2,,,,,Rebirth,アクティブ
How_to_Jump,How to Jump,,5.100.282,"Upon use, Isaac jumps in the direction he is currently moving, allowing travel over obstacles and enemies.",1,,,,,Rebirth,アクティブ
Isaac%27s_Tears,Isaac's Tears,,5.100.323,"Fires 8 tears around Isaac, which retain the damage, range, shot speed, and special tear effects. Each tear shot by Isaac increases item charge by one.",0,,,,,Rebirth,アクティブ
IV_Bag,IV Bag,,5.100.135,"Upon use, Isaac loses half a heart of health (or a full heart in Chapter 4 onward) for a random amount of coins, similar to a Blood Donation Machine.",1,,,,,Rebirth,アクティブ
Kamikaze!,Kamikaze!,,5.100.40,"Creates an explosion around Isaac, damaging him and nearby enemies as well as destroying obstacles.",0,,,,,Rebirth,アクティブ
Lemon_Mishap,Lemon Mishap,,5.100.56,"Creates a tiny pool of yellow creep, damaging enemies that cross it.",1,,,,,Rebirth,アクティブ
Magic_Fingers,Magic Fingers,,5.100.295,Uses 1 coin to deal a large amount of damage to all enemies in the room.,1,,,,,Rebirth,アクティブ
Mom%27s_Bottle_of_Pills,Mom's Bottle of Pills,,5.100.102,Gives Isaac a random pill.,1,,,,,Rebirth,アクティブ
Mom%27s_Bra,Mom's Bra,,5.100.39,Petrifies all enemies in the current room for around 4 seconds.,1,,,,,Rebirth,アクティブ
Mom%27s_Pad,Mom's Pad,,5.100.41,Inflicts fear to all enemies in the room for 5 seconds.,0,,,,,Rebirth,アクティブ
Monster_Manual,Monster Manual,,5.100.123,"Spawns a familiar from a specific selection for the current room.
Spawns a familiar from a specific selection for the current floor.",1,,,,,Rebirth,アクティブ
Monstro%27s_Tooth,Monstro's Tooth,,5.100.86,"A friendly Monstro jumps on a random enemy, dealing 120 area damage. Lands on Isaac if used in a room without enemies.",1,,,,,Rebirth,アクティブ
Mr._Boom,Mr. Boom,,5.100.37,Places a Mr. Mega bomb that deals 110 damage.,1,,,,,Rebirth,アクティブ
My_Little_Unicorn,My Little Unicorn,,5.100.77,"Gives invulnerability and +0.28 speed for six seconds, removing the ability to shoot tears and replacing it with the ability to deal 40 contact damage to enemies.",1,,+0.28,,,Rebirth,アクティブ
Notched_Axe,Notched Axe,,5.100.147,"Isaac destroys obstacles and opens Secret Rooms by walking into them, but cannot shoot or pick up items until it's cancelled.
Toggles between tears and the pickaxe, which can be swung to attack and break obstacles. Using it depletes the charge, and it can't be used until next floor once the charge runs out.",1,,,,,Rebirth,アクティブ
Pandora%27s_Box,Pandora's Box,,5.100.297,"Upon use, spawns specific pickups or items depending on the floor it is used on. Disappears after use.",2,,,,,Rebirth,アクティブ
Portable_Slot,Portable Slot,,5.100.177,"Upon use, consumes 1 penny and has a chance to drop a random pickup, like a Slot Machine.",0,,,,,Rebirth,アクティブ
Prayer_Card,Prayer Card,,5.100.146,Gives an Eternal Heart per use.,3,,,,,Rebirth,アクティブ
Razor_Blade,Razor Blade,,5.100.126,"On use, takes one heart of health and grants +1.2 damage for the current room.",0,+1.2,,,,Rebirth,アクティブ
Red_Candle,Red Candle,,5.100.289,"Throws a flame that that can pass over gaps (but not through obstacles). The flame damages everything in its path, diminishing in size as it hits enemies or blocks shots.",2,,,,,Rebirth,アクティブ
Remote_Detonator,Remote Detonator,,5.100.137,Bombs placed by Isaac only explode when Remote Detonator is used. Gives 5 bombs.,1,,,,,Rebirth,アクティブ
Satanic_Bible,Satanic Bible,,5.100.292,Gives one Black Heart. Replaces the boss room item on the current floor with a Devil Deal.,4,,,,,Rebirth,アクティブ
Scissors,Scissors,,5.100.325,Turns Isaac's head into a stationary familiar for the current room which fires tears automatically. Isaac's body also shoots a controllable fountain of blood shots for the room.,1,,,,,Rebirth,アクティブ
Shoop_Da_Whoop!,Shoop Da Whoop!,,5.100.49,Fires a laser from Isaac's mouth.,2,,,,,Rebirth,アクティブ
Spider_Butt,Spider Butt,,5.100.171,Deals 10 damage to all enemies in the room and slows them for 4 seconds. Enemies killed by Spider Butt spawn Blue Spiders.,1,,,,,Rebirth,アクティブ
Tammy%27s_Head,Tammy's Head,,5.100.38,"Shoots 10 tears in a circle around Isaac, which retain the Damage, Shot Speed, and special effects (such as poison) of Isaac's tears.",2,+25,,,,Rebirth,アクティブ
Telepathy_for_Dummies,Telepathy for Dummies,,5.100.192,Gives homing tears for the current room. Also gives +3 range.,0,,,,,Rebirth,アクティブ
Teleport!,Teleport!,,5.100.44,Teleports Isaac to a random room on the current floor.,0,,,,,Rebirth,アクティブ
The_Bean,The Bean,,5.100.111,"Isaac farts, poisoning any enemy in close range.",0,,,,,Rebirth,アクティブ
The_Bible,The Bible,,5.100.33,"On use, Isaac gains flight for the current room. Instantly kills Mom, Mom's Heart, and It Lives when activated, but kills Isaac when used on Satan.",1,,,,,Rebirth,アクティブ
The_Book_of_Belial,The Book of Belial,,5.100.34,"+2 damage for the current room.
Guarantees a Devil Room or Angel Room will be open after beating a boss while holding it. Increases the chance by 12.5%.",2,+2,,,,Rebirth,アクティブ
The_Book_of_Sin,The Book of Sin,,5.100.97,"Generates a random pickup, pill, card, or rune.",2,,,,,Rebirth,アクティブ
The_Boomerang,The Boomerang,,5.100.338,"Throws a boomerang which retrieves pickups, as well as damages and petrifies enemies hit for 2 seconds.",2,,,,,Rebirth,アクティブ
The_Candle,The Candle,,5.100.164,Throws out a temporary flame that can pass over gaps (but not through rocks). The flame damages anything in its path.,2,,,,,Rebirth,アクティブ
The_D6,The D6,,5.100.105,"Re-rolls all items in the current room into other items, depending on the current room's Item Pool.",4,,,,,Rebirth,アクティブ
The_Gamekid,The Gamekid,,5.100.93,"Turns Isaac into a into a Pac-Man-like creature for 6 seconds, granting invulnerability, inflicting fear on all enemies, and replenishing a Half Red Heart for every two enemies killed.",2,,,,,Rebirth,アクティブ
The_Hourglass,The Hourglass,,5.100.66,All enemies in the room are slowed for 8 seconds.,1,,,,,Rebirth,アクティブ
The_Jar,The Jar,,5.100.290,"When at full health, up to 4 extra Red Hearts can be stored in The Jar.",0,,,,,Rebirth,アクティブ
The_Nail,The Nail,,5.100.83,"Gives one Soul Heart half a Black Heart. For the current room; +0.7 damage, -0.18 speed, allows Isaac to break rocks and damage enemies by walking over them.",3,+0.7,-0.18,,,Rebirth,アクティブ
The_Necronomicon,The Necronomicon,,5.100.35,Deals 40 damage to every enemy in the room.,1,,,,,Rebirth,アクティブ
The_Pinking_Shears,The Pinking Shears,,5.100.107,"Gives flight for the current room, while turning Isaac's body into a fast, high damage familiar.",2,,,,,Rebirth,アクティブ
The_Poop,The Poop,,5.100.36,Spawns a pile of poop where Isaac is standing and knocks back nearby enemies. May yield pickups like regular poop.,0,,,,,Rebirth,アクティブ
Undefined,Undefined,,5.100.324,"Teleports Isaac to the Secret Room, Super Secret Room, Treasure Room, or I AM ERROR.",2,,,,,Rebirth,アクティブ
Unicorn_Stump,Unicorn Stump,,5.100.298,"Gives invulnerability and increased speed for five seconds, but removes the ability to shoot tears.",1,,+0.28,,,Rebirth,アクティブ
We_Need_to_Go_Deeper!,We Need to Go Deeper!,,5.100.84,Creates a trapdoor to go to the next floor.,0,,,,,Rebirth,アクティブ
White_Pony,White Pony,,5.100.181,"Passively gives flight and increases speed to 1.5. Upon use, Isaac charges in the direction the pony is facing, giving invulnerability during the charge and dealing 40 damage while also casting the effect of Crack the Sky.",2,,,,,Rebirth,アクティブ
Yum_Heart,Yum Heart,,5.100.45,Restores one full Red Heart.,1,,,,,Rebirth,アクティブ
Box_of_Friends,Box of Friends,,5.100.357,"Duplicates all of Isaac's familiars for the current room. If Isaac has no familiars, spawns a Demon Baby for the room instead.",1,,,,,AB,アクティブ
D12,D12,,5.100.386,"Re-rolls all Rocks and Metal Blocks in the current room into other random objects, such as Bomb Rocks, TNT, or Poops. Poops and TNT cannot be rerolled into other objects with this item.",0,,,,,AB,アクティブ
D7,D7,,5.100.437,"Restarts the current room and brings back all enemies, allowing more rewards to be acquired by completing the room.",1,,,,,AB,アクティブ
D8,D8,,5.100.406,"Re-rolls Isaac's damage, tears, range, and speed.",2,,,,,AB,アクティブ
Diplopia,Diplopia,,5.100.347,Duplicates all pickups and item pedestals in the room.,3,,,,,AB,アクティブ
Friendly_Ball,Friendly Ball,,5.100.382,"Throwing the ball at a monster instantly kills and captures it. The captured enemy can later be released and will be friendly, fighting for Isaac and persisting between rooms.",2,,,,,AB,アクティブ
Glass_Cannon,Glass Cannon,,5.100.352,"Fires a high-damage piercing spectral tear, but lowers Isaac's health to half a heart.
Fires a high-damage piercing spectral tear. If Isaac takes damage while holding this, he takes extra damage and it becomes Broken Glass Cannon.",1,,,,,AB,アクティブ
Glowing_Hour_Glass,Glowing Hour Glass,,5.100.422,"Rewinds time, putting Isaac back in the previous room and undoing anything that happened in the current room.",3,,,,,AB,アクティブ
Jar_of_Flies,Jar of Flies,,5.100.434,"Killing an enemy adds a fly to the jar, up to a maximum of 20. On use, releases Blue Flies equal to the number of flies in the jar.",2,,,,,AB,アクティブ
Kidney_Bean,Kidney Bean,,5.100.421,"Isaac farts, charming all nearby enemies.",1,,,,,AB,アクティブ
Mega_Bean,Mega Bean,,5.100.351,"Petrifies all enemies in the current room for a couple of seconds, poisons any enemies near Isaac, and sends a rock wave across the room in the direction Isaac is facing.",1,,,,,AB,アクティブ
Mega_Blast,Mega Blast,,5.100.441,"Upon use, Isaac fires a laser similar to the one used by Mega Satan. This laser deals massive damage, lasts for approximately 15 seconds, and persists between rooms. Isaac is pushed backwards by the force of the laser while it is active.",4,,,,,AB,アクティブ
Mine_Crafter,Mine Crafter,,5.100.427,"Places an explosive TNT barrel that can be pushed and used to destroy rocks or damage enemies when used. If used a second time in the same room while the previous TNT barrel is still intact, it will remotely explode the TNT.",1,,,,,AB,アクティブ
Mom%27s_Box,Mom's Box,,5.100.439,"Increases Luck by 1 and doubles the effects of trinkets while held. When used, drops a random trinket on the ground.",3,,,,,AB,アクティブ
Placebo,Placebo,,5.100.348,"When used, copies the effect of the pill Isaac is currently holding without consuming it. Does not copy the effects of cards or runes.",2,,,,,AB,アクティブ
Tear_Detonator,Tear Detonator,,5.100.383,"When used, will detonate any tears currently on the screen and cause each one to split into 6 more tears which will fire in a circle, similar to Tammy's Head.",1,,,,,AB,アクティブ
Teleport_2.0,Teleport 2.0,,5.100.419,"Teleports Isaac to a room that has not been explored yet. Normal rooms are prioritized over special rooms, and common special rooms take priority over rarer ones.",3,,,,,AB,アクティブ
Ventricle_Razor,Ventricle Razor,,5.100.396,"Can be used to place an orange portal and a blue portal. Upon entering a portal, Isaac is teleported to the other portal.",1,,,,,AB,アクティブ
Wooden_Nickel,Wooden Nickel,,5.100.349,"When used, has a 50% chance to drop a random coin.",1,,,,,AB,アクティブ
Black_Hole,Black Hole,,5.100.512,Throws a black hole on the ground which sucks in and damages enemies.,1,,,,,AB+,アクティブ
Book_of_the_Dead,Book of the Dead,,5.100.545,"Upon use, creates a friendly Bony, Black Bony, or an orbital bone for each enemy killed in the current room.
Can also create a friendly Bone Fly or Revenant.",3,,,,,AB+,アクティブ
Broken_Shovel,Broken Shovel,,5.100.550,"While held, causes 1 or more copies of Mom's Foot to stomp on Isaac. One of two parts necessary to create Mom's Shovel.",4,,,,,AB+,アクティブ
Brown_Nugget,Brown Nugget,,5.100.504,Spawns a stationary fly turret that fires tears at nearby enemies.,0,,,,,AB+,アクティブ
Clicker,Clicker,,5.100.482,Transforms Isaac into a random character and removes the last item collected.,0,,,,,AB+,アクティブ
Compost,Compost,,5.100.480,"Doubles Isaac's Blue Flies and Blue Spiders, or spawns one if Isaac has none. Converts pickups in the current room into Blue Flies or Blue Spiders.",2,,,,,AB+,アクティブ
Coupon,Coupon,,5.100.521,"While held, guarantees one item in every Shop will be on sale. On use, makes a random item in the current room free.",2,,,,,AB+,アクティブ
Crooked_Penny,Crooked Penny,,5.100.485,"Spawns a penny and has a 50% chance to double all items and pickups in the room. If the effect fails, the items and pickups disappear.",1,,,,,AB+,アクティブ
D_Infinity,D Infinity,,5.100.489,"Grants a random die item that changes each use.
Acts as any die item, and can by cycled by pressing the drop key.",4,,,,,AB+,アクティブ
D1,D1,,5.100.476,Duplicates a random pickup in the room.,4,,,,,AB+,アクティブ
Dataminer,Dataminer,,5.100.481,"Displaces enemy sprites for the current room, randomly increases one stat and decreases another.",0,,,,,AB+,アクティブ
Delirious,Delirious,,5.100.510,Spawns Delirium as a random friendly boss that fights for Isaac.,1,,,,,AB+,アクティブ
Dull_Razor,Dull Razor,,5.100.486,"Hurts Isaac without depleting health, activating any items that trigger upon taking damage.",1,,,,,AB+,アクティブ
Eden%27s_Soul,Eden's Soul,,5.100.490,Spawns two item pedestals then is consumed. Begins with no charges.,3,,,,,AB+,アクティブ
Mama_Mega!,Mama Mega!,,5.100.483,Damages all enemies and destroys all obstacles. The effect occurs every time a new room is entered for the rest of the floor. Opens the doors to the floor's Secret Rooms and Super Secret Rooms.,3,,,,,AB+,アクティブ
Metronome,Metronome,,5.100.488,Grants a random item effect for the current room.,1,,,,,AB+,アクティブ
Mom%27s_Shovel,Mom's Shovel,,5.100.552,Creates a trapdoor that leads to the next floor upon activation. Unlocks The Forgotten when used on a mound of dirt that appears in Dark Room.,4,,,,,AB+,アクティブ
Moving_Box,Moving Box,,5.100.523,"If the box is empty, picks up all items and pickups in a room and stores them. If the box is not empty, places all stored items and pickups in the current room.",1,,,,,AB+,アクティブ
Mr._ME!,Mr. ME!,,5.100.527,Summons a controllable ghost that can perform various tasks depending on what it targets.,3,,,,,AB+,アクティブ
Mystery_Gift,Mystery Gift,,5.100.515,"Upon use, spawns a random item from the current room's item pool, with a chance to spawn A Lump of Coal or The Poop instead.",3,,,,,AB+,アクティブ
Pause,Pause,,5.100.478,Freezes all enemies until a fire button is pressed.,1,,,,,AB+,アクティブ
Plan_C,Plan C,,5.100.475,"Kills all enemies in the room, then kills Isaac three seconds later.",0,,,,,AB+,アクティブ
Potato_Peeler,Potato Peeler,,5.100.487,"Removes a Heart Container, increases damage and range, and grants a Cube of Meat.",2,,,,,AB+,アクティブ
Sacrificial_Altar,Sacrificial Altar,,5.100.536,Sacrifices up to 2 familiars and spawns an item from the Devil Room pool for each familiar sacrificed. Converts all friendly spiders and flies into coins.,2,,,,,AB+,アクティブ
Sharp_Straw,Sharp Straw,,5.100.507,Damages all enemies in the room. Has a chance to drop a half red heart or half soul heart if an enemy is hit.,2,,,,,AB+,アクティブ
Smelter,Smelter,,5.100.479,Consumes Isaac's currently held trinket and applies its effect permanently.,3,,,,,AB+,アクティブ
Sprinkler,Sprinkler,,5.100.516,"Upon use, creates a stationary sprinkler that rotates and fires tears in 8 directions. The tears copy Isaac's stats and most tear effects.",2,,,,,AB+,アクティブ
Telekinesis,Telekinesis,,5.100.522,"Upon use, for the next two seconds, any enemy shots that come near Isaac are held in place. After the charge is depleted, they are fired back as tears.",1,,,,,AB+,アクティブ
Void,Void,,5.100.477,"Consumes all pedestal items in the room. Active items will have their effects added to Void, and passive items will grant random stat upgrades.",4,,+0.2,+0.5,+0.2,AB+,アクティブ
Wait_What%3F,Wait What?,,5.100.484,"Isaac farts, sending out rock waves.",1,,,,,AB+,アクティブ
Abyss,Abyss,,5.100.706,Destroys all items in the room and gives Isaac a unique locust familiar for each item destroyed. Some items generate locusts with special effects.,4,,,,,Repentance,アクティブ
Alabaster_Box,Alabaster Box,,5.100.585,"Spawns three Soul Hearts and two Angel Room items and is consumed. Starts with no charges, and can only be charged by picking up 6 Soul Hearts.",2,,,,,Repentance,アクティブ
Anima_Sola,Anima Sola,,5.100.722,"Chains down the nearest enemy for 5 seconds, preventing them from acting.",3,,,,,Repentance,アクティブ
Bag_of_Crafting,Bag of Crafting,,5.100.710,"Collects and holds up to 8 pickups, which can then be used to craft an item. The power level of the item is based on the quality of pickups used.",4,,,,,Repentance,アクティブ
Berserk!,Berserk!,,5.100.704,"Causes Isaac to go berserk for 5 seconds, greatly increasing his speed, tears, and damage, but restricting him to using a melee weapon instead of his tears. This item charges by dealing damage to enemies instead of clearing rooms.",3,+3,+0.4,,,Repentance,アクティブ
Book_of_Virtues,Book of Virtues,,5.100.584,"On use, spawns a destroyable orbiting Wisp familiar that fires tears and deals contact damage. Also acts as a passive item that causes other active items to spawn themed Wisps.",3,-2.4,,,,Repentance,アクティブ
Broken_Glass_Cannon,Broken Glass Cannon,,5.100.474,Begins with no charges and turns into Glass Cannon when used. Only acquired by taking damage while holding Glass Cannon.,0,,,,,Repentance,アクティブ
Clear_Rune,Clear Rune,,5.100.263,Has the same effect as the rune or soul stone currently held by Isaac.,2,,,,,Repentance,アクティブ
Damocles,Damocles,,5.100.577,"Spawns a sword above Isaac's head, which doubles all item pedestals. After Isaac takes damage, the sword can randomly fall at any point, instantly killing him.",2,,,,,Repentance,アクティブ
Dark_Arts,Dark Arts,,5.100.705,"Briefly grants +1 speed and makes Isaac invulnerable and intangible. When the effect ends, destroys all projectiles and damages all enemies Isaac ran through.",3,+1,+1.0,,,Repentance,アクティブ
Death_Certificate,Death Certificate,,5.100.628,"Takes Isaac to an abandoned and expanded version of Home, which has one copy of every item in the game. After taking an item, Isaac returns to the room he used Death Certificate in.",4,,,,,Repentance,アクティブ
Decap_Attack,Decap Attack,,5.100.729,"Throws Isaac's head, which is still able to fire tears at the spot it lands. Reactivating the item or stepping on the head reattaches it.",2,,,,,Repentance,アクティブ
Eraser,Eraser,,5.100.638,"Throws an eraser that instantly kills the first monster it hits, and prevents that monster from spawning for the rest of the run. Can only be used once per floor.",2,,,,,Repentance,アクティブ
Esau_Jr.,Esau Jr.,,5.100.703,"Swaps between the current character and Esau Jr., who has +2 flat damage and flight. Characters have independent items and health. Dying as either character ends the run.",2,,,,,Repentance,アクティブ
Eternal_D6,Eternal D6,,5.100.609,Rerolls all items in the room. Each item has a 30% chance to disappear instead.,3,,,,,Repentance,アクティブ
Everything_Jar,Everything Jar,,5.100.720,"Spawns certain pickups based on how many charges it has. If fully charged, instead has one of many unique effects.",2,,,,,Repentance,アクティブ
Flip,Flip,,5.100.711,"Item pedestals have a second uninteractable ""ghostly"" item behind them. Activating will flip the real and ghostly items around. If playing as Tainted Lazarus, also flips between them and Dead Tainted Lazarus.",4,,,,,Repentance,アクティブ
Fortune_Cookie,Fortune Cookie,,5.100.557,"Gives Isaac a fortune, Soul Heart, Card, Rune, or trinket, similar to a Fortune Telling Machine. Fortunes are much more likely to be given than anything else.",2,,,,,Repentance,アクティブ
Free_Lemonade,Free Lemonade,,5.100.578,Creates a large pool of yellow creep beneath Isaac.,1,,,,,Repentance,アクティブ
