norm_name,Item Name,アイテム名,ID,効果,クオリティ,Damage Up,Tears Up,Speed Up,Shotspeed,DLC,種類
Lil_Haunt,Lil Haunt,,5.100.277,"Spawns a familiar that chases down enemies, dealing 4 damage per second and inflicting fear.",1,,,,,Rebirth,パッシブ
Little_Baggy,Little Baggy,,5.100.252,Isaac can hold 2 pills at once and all cards and runes are replaced by pills.,1,,,,,Rebirth,パッシブ
Little_C.H.A.D.,Little C.H.A.D.,,5.100.96,Spawns a familiar who drops a Half Red Heart every 3 rooms.,2,,,,,Rebirth,パッシブ
Little_Chubby,Little Chubby,,5.100.88,Spawns a charger familiar that charges forward and deals contact damage to any enemies in its path.,1,,,,,Rebirth,パッシブ
Little_Gish,Little Gish,,5.100.99,"Spawns a familiar that follows Isaac around and fires slowing tears, impeding enemies' speed.",2,,,,,Rebirth,パッシブ
Little_Steven,Little Steven,,5.100.100,Spawns a familiar who follows Isaac around and fires homing tears.,1,,,,,Rebirth,パッシブ
Loki%27s_Horns,Loki's Horns,,5.100.87,Gives a random chance for projectiles to fire in all 4 cardinal directions.,1,,,,,Rebirth,パッシブ
Lord_of_the_Pit,Lord of the Pit,,5.100.82,Grants flight and +0.3 speed.,3,,+0.3,,,Rebirth,パッシブ
Lost_Contact,Lost Contact,,5.100.213,Isaac's tears can hit and destroy enemy projectiles. -0.16 shot speed.,2,,,,-0.16,Rebirth,パッシブ
Lucky_Foot,Lucky Foot,,5.100.46,"+1 luck. Increases chance of winning Shell Games and Fortune Tellers (independent from the luck stat).
Converts all bad pills into good pills, without identifying them.",2,,,,,Rebirth,パッシブ
Lunch,Lunch,,5.100.22,Grants one full Red Heart container. Heals 1 additional Red Heart.,1,,,,,Rebirth,パッシブ
Maggy%27s_Bow,Maggy's Bow,,5.100.312,Gives one Red Heart Container and doubles the healing provided by Red Hearts. Also heals 1 Red Heart when obtained.,2,,,,,Rebirth,パッシブ
Magic_8_Ball,Magic 8 Ball,,5.100.194,"+0.16 shot speed, spawns a random tarot card. Increases the chance of finding a Planetarium.",1,,,,+0.16,Rebirth,パッシブ
Magic_Mushroom,Magic Mushroom,,5.100.12,"Makes Isaac bigger. Adds one Red Heart Container, +0.3 Damage, x1.5 damage multiplier, +5.25 / +1.5 Range, and +0.3 Speed, and restores all Health.",4,+0.3,+0.3,,,Rebirth,パッシブ
Magic_Scab,Magic Scab,,5.100.253,"Grants one full Red Heart container, +1 luck.",2,,,,,Rebirth,パッシブ
Magneto,Magneto,,5.100.53,Pulls pickups towards Isaac.,1,,,,,Rebirth,パッシブ
Match_Book,Match Book,,5.100.344,"Grants Isaac one Black Heart, spawns two or three Bombs.",1,,,,,Rebirth,パッシブ
MEAT!,MEAT!,,5.100.193,"Grants one full Red Heart container, +0.3 damage.",2,+0.3,,,,Rebirth,パッシブ
Midas%27_Touch,Midas' Touch,,5.100.202,Enemies that touch Isaac are temporarily petrified and turn to gold. Any enemy killed while in this state will drop coins.,2,,,,,Rebirth,パッシブ
Mini_Mush,Mini Mush,,5.100.71,"Decreases Isaac's size, making him less likely to be hit. +0.3 speed, +1.5 tear height, -4.25 range (effective range is increased). +0.3 speed, +1.50 range.",2,,+0.3,,,Rebirth,パッシブ
Missing_No.,Missing No.,,5.100.258,Randomizes all passive items and stats upon pickup and at the start of each succeeding floor.,2,,,,,Rebirth,パッシブ
Missing_Page_2,Missing Page 2,,5.100.262,"Grants one Black Heart. Upon taking damage that reduces Isaac's health to one heart or less, deals 40 damage to all enemies in the room.
Deals 80 damage, and increases the damage of Black Hearts and The Necronomicon-like effects by 40.",0,+40,,,,Rebirth,パッシブ
Mitre,Mitre,,5.100.173,Grants a chance of converting any Red Heart pickups into Soul Hearts instead.,3,,,,,Rebirth,パッシブ
Mom%27s_Coin_Purse,Mom's Coin Purse,,5.100.195,Spawns 4 random pills near Isaac.,1,,,,,Rebirth,パッシブ
Mom%27s_Contacts,Mom's Contacts,,5.100.110,"+0.25 range. Adds a chance to shoot petrifying tears, which stop enemies in place and prevent them from moving or attacking.",3,,,,,Rebirth,パッシブ
Mom%27s_Eye,Mom's Eye,,5.100.55,Gives Isaac a chance to fire tears from the back of his head.,1,,,,,Rebirth,パッシブ
Mom%27s_Eyeshadow,Mom's Eyeshadow,,5.100.200,Tears have a chance to charm enemies.,1,,,,,Rebirth,パッシブ
Mom%27s_Heels,Mom's Heels,,5.100.30,"+5.25 range, +0.5 tear height. Enemies that touch Isaac take 12 damage.",1,,,,,Rebirth,パッシブ
Mom%27s_Key,Mom's Key,,5.100.199,Adds 2 keys. Chests will drop additional pickups.,3,,,,,Rebirth,パッシブ
Mom%27s_Knife,Mom's Knife,,5.100.114,"Isaac's tears are replaced by a knife that pierces enemies, can travel through obstacles, and can hurt enemies while Isaac is holding it. Holding down the fire button before firing increases its range and power.",4,,,,,Rebirth,パッシブ
Mom%27s_Lipstick,Mom's Lipstick,,5.100.31,"+5.25 range, +0.5 tear height. Spawns one random heart.",1,,,,,Rebirth,パッシブ
Mom%27s_Perfume,Mom's Perfume,,5.100.228,Adds a chance to shoot fear tears and decreases tear delay by 1.,2,,,,,Rebirth,パッシブ
Mom%27s_Purse,Mom's Purse,,5.100.139,Allows Isaac to hold 1 additional trinket.,3,,,,,Rebirth,パッシブ
Mom%27s_Underwear,Mom's Underwear,,5.100.29,"+5.25 range, +0.5 tear height. Spawns 3-6 Blue Flies on pickup.",1,,,,,Rebirth,パッシブ
Mom%27s_Wig,Mom's Wig,,5.100.217,Adds a chance to spawn Blue Spiders when firing tears. Restores 1 red heart.,3,,,,,Rebirth,パッシブ
Money_%3D_Power,Money = Power,,5.100.109,"Increases damage by 0.04 for every coin Isaac has, up to +3.96 damage at 99 coins.",3,+3.96,,,,Rebirth,パッシブ
Mongo_Baby,Mongo Baby,,5.100.322,Spawns a familiar that copies the tears of Isaac's other familiars.,2,,,,,Rebirth,パッシブ
Monstro%27s_Lung,Monstro's Lung,,5.100.229,Replaces normal tears with a charged shot that fires 14 tears in the same fashion as Monstro.,2,,,,,Rebirth,パッシブ
Mr._Mega,Mr. Mega,,5.100.106,"Grants 5 bombs, and makes all dropped bombs larger, which have an increased blast radius and increased damage.",2,,,,,Rebirth,パッシブ
Mutant_Spider,Mutant Spider,,5.100.153,Grants quadruple shot but decreases tears.,3,,,,,Rebirth,パッシブ
My_Reflection,My Reflection,,5.100.5,"Gives Isaac's tears a boomerang effect. +1.5 range, +1 tear height, x1.6 shot speed multiplier.",0,,,,,Rebirth,パッシブ
Mysterious_Liquid,Mysterious Liquid,,5.100.317,"Tears leave a small, short lasting pool of creep on impact or when their range is depleted.",3,,,,,Rebirth,パッシブ
Mystery_Sack,Mystery Sack,,5.100.271,"Spawns a familiar that drops a Heart, coin, bomb, or key every 5-6 rooms.",2,,,,,Rebirth,パッシブ
Number_One,Number One,,5.100.6,"Grants +1.5 tears, but severely reduces range.",2,,,+1.5,,Rebirth,パッシブ
Odd_Mushroom_(Thin),Odd Mushroom,,5.100.121,"Grants one empty Heart container, +0.3 damage, +0.25 range, +0.5 tear height, and -0.1 speed.",2,+0.3,-0.1,,,Rebirth,パッシブ
Odd_Mushroom_(Thin),Odd Mushroom,,5.100.120,"+1.7 tears, +0.3 speed, slightly reduces damage.",2,,+0.3,+1.7,,Rebirth,パッシブ
Old_Bandage,Old Bandage,,5.100.219,Grants an empty Red Heart container. Adds a chance of dropping a Red Heart after taking damage.,2,,,,,Rebirth,パッシブ
Ouija_Board,Ouija Board,,5.100.115,Grants spectral tears that travel through obstacles (but not enemies) instead of breaking on impact with them.,2,,,,,Rebirth,パッシブ
Pageant_Boy,Pageant Boy,,5.100.141,Spawns seven random coins around Isaac.,0,,,,,Rebirth,パッシブ
Pentagram,Pentagram,,5.100.51,"+1 damage, increases Devil Room / Angel Room chance by 10%.",3,+1,,,,Rebirth,パッシブ
PHD,PHD,,5.100.75,"Converts all bad pills into good pills, spawns one pill pickup, and identifies all pills. Restores two Red Hearts and increases the payout of Blood Donation Machines.",2,,,,,Rebirth,パッシブ
Piggy_Bank,Piggy Bank,,5.100.227,"Gives 3 pennies on pick-up. Every time Isaac is damaged, he will drop one additional penny.",1,,,,,Rebirth,パッシブ
Pisces,Pisces,,5.100.309,"-1 Tear Delay, adds knock-back shots and increases tear size.",2,,,,,Rebirth,パッシブ
Placenta,Placenta,,5.100.218,"Grants one full Red Heart container, and a chance to regenerate a Half Red Heart of health every minute of gameplay.",2,,,,,Rebirth,パッシブ
Polyphemus,Polyphemus,,5.100.169,"Isaac fires huge tears that deal massive damage, but fire rate is greatly decreased. If a tear kills an enemy, it travels on with any leftover damage.",4,,,,,Rebirth,パッシブ
Proptosis,Proptosis,,5.100.261,"Tears start out massive with high damage, and then shrink down and become weaker over a short range.",4,+0.5,,,,Rebirth,パッシブ
Punching_Bag,Punching Bag,,5.100.281,Spawns a Mulligan familiar that wanders randomly. Enemies will attack the Mulligan if it's closer.,1,,,,,Rebirth,パッシブ
Pyro,Pyro,,5.100.190,Grants 99 Bombs.,3,,,,,Rebirth,パッシブ
Pyromaniac,Pyromaniac,,5.100.223,+5 bombs. Grants immunity to explosion damage and causes explosions to heal Isaac. Also grants immunity to fire.,4,,,,,Rebirth,パッシブ
Rainbow_Baby,Rainbow Baby,,5.100.174,Spawns a familiar that follows Isaac around and fires tears with random effects.,1,,,,,Rebirth,パッシブ
Raw_Liver,Raw Liver,,5.100.16,Grants 2 Red Heart containers and completely restores health.,2,,,,,Rebirth,パッシブ
Robo-Baby,Robo-Baby,,5.100.95,Spawns a familiar that shoots Technology lasers.,1,,,,,Rebirth,パッシブ
Robo-Baby_2.0,Robo-Baby 2.0,,5.100.267,Spawns a familiar that fires lasers at any enemy in its line of sight and moves based on the direction Isaac is firing tears.,1,,,,,Rebirth,パッシブ
Roid_Rage,Roid Rage,,5.100.14,"+0.6 speed, +5.25 range, +0.5 tear height.
+0.3 speed, +1.50 range, +0.5 tear height.",2,,+0.6,,,Rebirth,パッシブ
Rosary,Rosary,,5.100.72,"Adds 3 Soul Hearts. The Bible will appear in any item pool.
Also a +0.5 tears up.",2,,,+0.5,,Rebirth,パッシブ
Rotten_Baby,Rotten Baby,,5.100.268,Spawns a familiar that spawns a Blue Fly when Isaac shoots. It can only have one Fly at a time.,3,,,,,Rebirth,パッシブ
Rotten_Meat,Rotten Meat,,5.100.26,Grants one full Red Heart container. Heals 1 additional Red Heart.,1,,,,,Rebirth,パッシブ
Rubber_Cement,Rubber Cement,,5.100.221,"Tears bounce off walls, enemies, and environmental objects.",3,,,,,Rebirth,パッシブ
Sack_of_Pennies,Sack of Pennies,,5.100.94,Spawns a familiar that drops a coin every 2 rooms.,1,,,,,Rebirth,パッシブ
Sacred_Heart,Sacred Heart,,5.100.182,"Gives Isaac a red Heart Container and replenishes all Red Hearts. Grants homing tears, a x2.3 Damage multiplier, +1 flat Damage, -0.4 Tears, -0.25 Shot Speed, +0.75 Tear Height +4.125 Range",4,,,-0.4,-0.25,Rebirth,パッシブ
Sacrificial_Dagger,Sacrificial Dagger,,5.100.172,"Spawns a dagger orbital familiar, blocking enemy shots and dealing a high amount of damage to enemies in contact.",2,,,,,Rebirth,パッシブ
Sad_Bombs,Sad Bombs,,5.100.220,"+5 Bombs. Upon exploding, bombs shoot 10 tears around them, affected by tear modifiers.",2,,,,,Rebirth,パッシブ
Safety_Pin,Safety Pin,,5.100.339,"Grants one Black Heart, +5.25 range, +0.5 tear height, +0.16 shot speed.",1,,,,+0.16,Rebirth,パッシブ
Sagittarius,Sagittarius,,5.100.306,Increases speed by +0.2 and grants piercing tears.,3,,+0.2,,,Rebirth,パッシブ
Samson%27s_Chains,Samson's Chains,,5.100.321,"Attaches a ball and chain to Isaac that pulls behind him that damages enemies, blocks shots, and destroys most obstacles.",1,,,,,Rebirth,パッシブ
Scapular,Scapular,,5.100.142,"Once per room, when Isaac is reduced to his last half heart, he is granted one Soul Heart.",2,,,,,Rebirth,パッシブ
Scorpio,Scorpio,,5.100.305,"Grants poison tears, which deal damage over time when inflicted.",3,,,,,Rebirth,パッシブ
Screw,Screw,,5.100.255,"+0.5 tears, +0.2 shot speed.",3,,,+0.5,+0.2,Rebirth,パッシブ
Sharp_Plug,Sharp Plug,,5.100.205,Damages Isaac in exchange for fully recharging Isaac's current activated item.,1,,,,,Rebirth,パッシブ
Sissy_Longlegs,Sissy Longlegs,,5.100.280,"Spawns a familiar that wanders randomly, occasionally spawning Blue Spiders.",1,,,,,Rebirth,パッシブ
Sister_Maggy,Sister Maggy,,5.100.67,Spawns a familiar that follows Isaac around shooting normal tears.,1,,,,,Rebirth,パッシブ
Skatole,Skatole,,5.100.9,Flies become harmless or less dangerous depending on the type.,0,,,,,Rebirth,パッシブ
Skeleton_Key,Skeleton Key,,5.100.17,Gives Isaac 99 Keys.,3,,,,,Rebirth,パッシブ
Smart_Fly,Smart Fly,,5.100.264,"Spawns an orbital familiar that blocks enemy shots. Upon taking damage, the familiar will pursue enemies for the rest of the room, dealing 22.5 damage per second.",2,,,,,Rebirth,パッシブ
SMB_Super_Fan,SMB Super Fan,,5.100.189,"+1 Red Heart container, +0.3 damage, +0.2 tears, +0.2 speed, +0.5 range, +1 tear height. Fully restores all red hearts.",3,+0.3,+0.2,+0.2,,Rebirth,パッシブ
Soy_Milk,Soy Milk,,5.100.330,"Tears are smaller and do much less damage, but fire in very rapid succession.",2,,,,,Rebirth,パッシブ
Speed_Ball,Speed Ball,,5.100.143,"+0.3 speed, +0.2 shot speed.",2,,+0.3,,+0.2,Rebirth,パッシブ
Spelunker_Hat,Spelunker Hat,,5.100.91,"Reveals type of adjacent rooms, including location for Secret Rooms and Super Secret Rooms.",2,,,,,Rebirth,パッシブ
Spider_Bite,Spider Bite,,5.100.89,"Adds a chance to shoot slowing tears, reducing speed of enemy movement and any projectile fired by them.",2,,,,,Rebirth,パッシブ
Spiderbaby,Spiderbaby,,5.100.211,"When hit, spawns 1-2 Blue Spiders.
When hit, spawns 3-5 Blue Spiders.",1,,,,,Rebirth,パッシブ
Spirit_of_the_Night,Spirit of the Night,,5.100.159,Grants spectral tears and flight.,3,,,,,Rebirth,パッシブ
Spoon_Bender,Spoon Bender,,5.100.3,Grants Isaac homing tears.,3,,,,,Rebirth,パッシブ
Squeezy,Squeezy,,5.100.196,"Increases tears by 0.4, spawns 2 Soul Hearts.",3,,,+0.4,,Rebirth,パッシブ
Starter_Deck,Starter Deck,,5.100.251,Isaac can hold 2 cards at once and all pills are replaced by cards.,2,,,,,Rebirth,パッシブ
Steam_Sale,Steam Sale,,5.100.64,"Reduces all Shop prices by 50%, rounded down to 7 coins for an item, rounded up to 2-3 coins for a pickup.",2,,,,,Rebirth,パッシブ
Stem_Cells,Stem Cells,,5.100.176,Grants one full Red Heart container and +0.16 shot speed.,1,,,,+0.16,Rebirth,パッシブ
Steven_(Item),Steven,,5.100.50,Increases damage by 1.,3,+1,,,,Rebirth,パッシブ
Stigmata,Stigmata,,5.100.138,"Increases damage, and adds 1 heart container.",2,+0.3,,,,Rebirth,パッシブ
Stop_Watch,Stop Watch,,5.100.232,"Automatically inflicts slow to all enemies in every room.
Upon taking damage, inflicts slow to all enemies for the current room.
Slows all enemies in every room to 80% speed.",4,,+0.3,,,Rebirth,パッシブ
Strange_Attractor,Strange Attractor,,5.100.315,"Pickups, trinkets, and monsters are magnetically attracted to Isaac's tears.",0,,,,,Rebirth,パッシブ
Super_Bandage,Super Bandage,,5.100.92,Grants one full Red Heart container and 2 Soul Hearts.,2,,,,,Rebirth,パッシブ
Synthoil,Synthoil,,5.100.345,"+1 damage, +5.25 range, +0.5 tear height.",3,+1,,,,Rebirth,パッシブ
Taurus,Taurus,,5.100.299,"-0.3 Speed. Isaac builds speed while in a room with enemies. At max speed, he gains the My Little Unicorn effect for 5 seconds.",1,,-0.3,,,Rebirth,パッシブ
Tech.5,Tech.5,,5.100.244,"Isaac occasionally fires an unlimited range piercing laser alongside his normal tears. The laser can glitch, mimicking the effects of certain items and trinkets.",3,,,,,Rebirth,パッシブ
Technology,Technology,,5.100.68,Replaces tears with a piercing laser with unlimited range.,3,,,,,Rebirth,パッシブ
Technology_2,Technology 2,,5.100.152,Replaces the tears fired from Isaac's right eye with a rapid-firing low damage piercing laser. Damage down.,2,,,,,Rebirth,パッシブ
The_Battery,The Battery,,5.100.63,"Activated collectibles can store an extra level of charge, allowing them to be used twice in one room.",2,,,,,Rebirth,パッシブ
The_Belt,The Belt,,5.100.28,Increases speed by 0.3.,1,,+0.3,,,Rebirth,パッシブ
The_Black_Bean,The Black Bean,,5.100.180,"When taking damage, Isaac farts, causing poison damage to all enemies in range.",0,,,,,Rebirth,パッシブ
The_Body,The Body,,5.100.334,Adds 3 Red Heart Containers.,3,,,,,Rebirth,パッシブ
The_Common_Cold,The Common Cold,,5.100.103,"Adds a chance to shoot poison tears, dealing damage over time when inflicted.",1,,,,,Rebirth,パッシブ
The_Compass,The Compass,,5.100.21,"Reveals the locations and types of all special rooms on the map, except Secret Rooms and Super Secret Rooms.",2,,,,,Rebirth,パッシブ
The_Halo,The Halo,,5.100.101,"Grants one full Red Heart container, +0.3 damage, +0.2 tears, +0.25 range, +0.3 speed, and +0.5 tear height.",2,+0.3,+0.3,+0.2,,Rebirth,パッシブ
The_Inner_Eye,The Inner Eye,,5.100.2,Grants triple shot but decreases tears.,2,,,,,Rebirth,パッシブ
The_Ladder,The Ladder,,5.100.60,Allows Isaac to walk across gaps one square across by automatically placing a ladder between the two walkable sections.,1,,,,,Rebirth,パッシブ
The_Ludovico_Technique,The Ludovico Technique,,5.100.329,"Instead of firing tears, Isaac controls one floating tear that hover over obstacles. This tear deals constant damage when held in place over an enemy.",2,,,,,Rebirth,パッシブ
The_Mark,The Mark,,5.100.79,"Grants one Soul Heart, +1 damage, and +0.2 speed.",3,+1,+0.2,,,Rebirth,パッシブ
The_Mind,The Mind,,5.100.333,"Reveals the entire map, including all special rooms and Secret Rooms.",3,,,,,Rebirth,パッシブ
The_Mulligan,The Mulligan,,5.100.151,Tears have a 1/6 chance of spawning allied Blue Flies when they hit an enemy.,3,,,,,Rebirth,パッシブ
The_Negative,The Negative,,5.100.328,"If Isaac has half a red heart or no red hearts after taking damage, all enemies in the room take significant damage. Allows entrance into the Dark Room. Also allows access to Home.",2,+1,,,,Rebirth,パッシブ
The_Pact,The Pact,,5.100.80,"Grants two Soul Hearts, +0.5 damage, and +0.7 tears.
Grants two Black Hearts, +0.5 damage, and +0.7 tears.",3,+0.5,,+0.7,,Rebirth,パッシブ
The_Parasite,The Parasite,,5.100.104,Isaac's tears split in two when they hit something.,3,,,,,Rebirth,パッシブ
The_Peeper,The Peeper,,5.100.155,"Spawns a familiar that floats slowly around the room on a zig-zag pattern, damaging enemies it passes through.",2,,,,,Rebirth,パッシブ
The_Polaroid,The Polaroid,,5.100.327,"If Isaac has half a red heart or no red hearts after taking damage, he gains a shield that nullifies all types of damage for 5 seconds. Allows entrance into Chest. Also allows access to Home.",2,,,,,Rebirth,パッシブ
The_Relic,The Relic,,5.100.98,Spawns a cross familiar that drops a Soul Heart every 5-6 rooms.,4,,,,,Rebirth,パッシブ
The_Sad_Onion,The Sad Onion,,5.100.1,Increases tears by 0.7.,3,,,+0.7,,Rebirth,パッシブ
The_Small_Rock,The Small Rock,,5.100.90,"Increases damage by 1, increases tears by 0.2, and decreases speed by 0.2.",3,+1,-0.2,+0.2,,Rebirth,パッシブ
The_Soul,The Soul,,5.100.335,Grants two Soul Hearts. Isaac gains a pulsing aura that repels enemies and projectiles.,3,,,,,Rebirth,パッシブ
The_Virus,The Virus,,5.100.13,Isaac poisons enemies on contact. -0.1 speed. +0.2 speed. Poisoned enemies have a chance to drop a black heart when killed.,2,,-0.1,,,Rebirth,パッシブ
The_Wafer,The Wafer,,5.100.108,All sources of damage that would cause more than one-half heart of damage are reduced to one-half heart instead.,4,,,,,Rebirth,パッシブ
There%27s_Options,There's Options,,5.100.249,Two items appear after defeating a Boss. Only one can be taken; the other will disappear.,3,,,,,Rebirth,パッシブ
Thunder_Thighs,Thunder Thighs,,5.100.314,Destroys rocks upon contact with Isaac. Adds one Red Heart container and lowers Speed.,1,,-0.4,,,Rebirth,パッシブ
Tiny_Planet,Tiny Planet,,5.100.233,Range up and makes shot tears revolve around Isaac until they drop.,0,,,,,Rebirth,パッシブ
Toothpicks,Toothpicks,,5.100.183,"+0.7 tears, +0.16 shot speed.",3,,,+0.7,+0.16,Rebirth,パッシブ
Torn_Photo,Torn Photo,,5.100.341,"+0.7 tears, +0.16 shot speed.",3,,,+0.7,+0.16,Rebirth,パッシブ
Tough_Love,Tough Love,,5.100.150,"Adds a chance to shoot a tooth instead of a tear, which deals x3.2 Isaac's damage.",3,,,,,Rebirth,パッシブ
Transcendence,Transcendence,,5.100.20,Grants flight.,3,,,,,Rebirth,パッシブ
Treasure_Map,Treasure Map,,5.100.54,Reveals the map of each floor. It does not identify special rooms and does not reveal the locations of Secret Rooms / Super Secret Rooms.,2,,,,,Rebirth,パッシブ
Trinity_Shield,Trinity Shield,,5.100.243,Isaac gains a shield that protects him from enemy shots. It aims in the direction Isaac fires from.,3,,,,,Rebirth,パッシブ
Virgo,Virgo,,5.100.303,Adds a chance to give a shield that nullifies all incoming damage for 10 seconds upon taking damage. Also converts bad pills into good pills.,2,,,,,Rebirth,パッシブ
Whore_of_Babylon,Whore of Babylon,,5.100.122,Grants +1.5 Damage and +0.3 Speed whenever Isaac has half a Red Heart or less.,2,+1.5,+0.3,,,Rebirth,パッシブ
Wire_Coat_Hanger,Wire Coat Hanger,,5.100.32,Increases tears by 0.7.,3,,,+0.7,,Rebirth,パッシブ
Wooden_Spoon,Wooden Spoon,,5.100.27,Increases speed by 0.3.,1,,+0.3,,,Rebirth,パッシブ
X-Ray_Vision,X-Ray Vision,,5.100.76,Reveals and opens all Secret Room and Super Secret Room entrances.,2,,,,,Rebirth,パッシブ
8_Inch_Nails,8 Inch Nails,,5.100.359,"+1.5 damage. Replaces Isaac's tears with nails, which have increased knockback.",3,+1.5,,,,AB,パッシブ
Athame,Athame,,5.100.408,"When Isaac takes damage, a black ring briefly appears around him, dealing damage to all nearby enemies.",1,,,,,AB,パッシブ
Betrayal,Betrayal,,5.100.391,"Every time Isaac takes damage, a charm effect is applied to every enemy in the room, causing them to attack each other rather than Isaac.",0,,,,,AB,パッシブ
Binky,Binky,,5.100.438,"Grants one Soul Heart, +0.75 tears and decreases Isaac's size.",3,,,+0.75,,AB,パッシブ
Black_Powder,Black Powder,,5.100.420,"Isaac leaves a trail of black powder on the floor. Walking in a circle will spawn a pentagram symbol on the floor, which deals 10 damage per tick to any enemies inside it.",1,,,,,AB,パッシブ
Bomber_Boy,Bomber Boy,,5.100.353,+5 bombs. Isaac's bombs will now explode in a large cross-shaped pattern (roughly 5 bombs explosions wide). This also affects player-spawned Troll Bombs.,2,,,,,AB,パッシブ
Bumbo,Bumbo,,5.100.385,"Spawns a beggar familiar which picks up any nearby coins, leveling up after collecting several coins. At level 2, Bumbo gains a body. At level 3, it begins to fire tears. At level 4, Bumbo follows enemies and gains contact damage.",1,,,,,AB,パッシブ
Bursting_Sack,Bursting Sack,,5.100.377,Spider enemies no longer target or deal contact damage to Isaac.,1,,,,,AB,パッシブ
Cambion_Conception,Cambion Conception,,5.100.412,"After taking damage a certain amount of times, a permanent demonic familiar spawns.",2,,,,,AB,パッシブ
Car_Battery,Car Battery,,5.100.356,Causes Isaac's activated item to activate twice on each use.,3,,,,,AB,パッシブ
Censer,Censer,,5.100.387,Spawns a familiar which creates a circular aura that slows down enemies and enemy shots inside.,3,,,,,AB,パッシブ
Chaos,Chaos,,5.100.402,Drops 1-6 random pickups on the floor. Causes items to be chosen from random item pools.,3,,,,,AB,パッシブ
Charged_Baby,Charged Baby,,5.100.372,"Spawns a familiar that occasionally drops a Lil' Battery, gives an active item charge, or petrifies all enemies in the room.",3,,,,,AB,パッシブ
Circle_of_Protection,Circle of Protection,,5.100.423,"Surrounds Isaac with a large white halo that occasionally deals Isaac's tear damage to enemies inside it, and can convert enemy shots into friendly homing tears.",1,,,,,AB,パッシブ
Continuum,Continuum,,5.100.369,Grants spectral tears and increases range. Tears travel through walls and appear at the opposite side of the room.,2,,,,,AB,パッシブ
Crack_Jacks,Crack Jacks,,5.100.354,Grants one full Red Heart container and drops a random trinket.,2,,,,,AB,パッシブ
Crown_of_Light,Crown of Light,,5.100.415,"+2 soul hearts. While Isaac has no empty red hearts, grants 2x damage, +5.25 range, and -0.3 shot speed. Regardless of health, the crown deactivates for the current room when Isaac takes damage.",4,,,,-0.3,AB,パッシブ
Curse_of_the_Tower,Curse of the Tower,,5.100.371,"Upon taking damage, spawns six Troll Bombs around the room, similar to the effect of XVI - The Tower.",1,,,,,AB,パッシブ
Dead_Eye,Dead Eye,,5.100.373,Isaac's damage increases each time an enemy is hit. Damage is reset upon missing a shot.,3,,,,,AB,パッシブ
Deep_Pockets,Deep Pockets,,5.100.416,"Allows Isaac to carry two cards or pills (or a combination of both) at the same time.
Increases the coin cap to 999. If a room would otherwise yield no reward, 1-3 coins will spawn.",2,,,,,AB,パッシブ
Eden%27s_Blessing,Eden's Blessing,,5.100.381,+0.7 tears up. Grants a random item at the start of the next run.,3,,,+0.7,,AB,パッシブ
Empty_Vessel,Empty Vessel,,5.100.409,"Grants two Black Hearts. While Isaac has no red hearts, grants flight and periodically grants an invincibility shield for a few seconds.",2,,,,,AB,パッシブ
Epiphora,Epiphora,,5.100.368,"Shooting in one direction increases Isaac's rate of fire until the cap is reached. As soon as Isaac changes direction or stops shooting, rate of fire is reset to its normal amount.",1,,,,,AB,パッシブ
Evil_Eye,Evil Eye,,5.100.410,Adds a chance to fire a slow-moving eye that fires tears in the same direction as Isaac. The eye will be destroyed if it hits an enemy or obstacle.,2,,,,,AB,パッシブ
