norm_name,Item Name,アイテム名,ID,効果,クオリティ,種類,プール
Toxic_Shock,Toxic Shock,有毒ショック,5.100.350,"部屋に入ったとき全ての敵を毒状態にし、アイザックのダメージの2倍を与える。
倒された敵は短時間で消える小さな緑色のクリープを地上に残す。",3,パッシブ,"treasure,"
Mega_Bean,Mega Bean,メガ豆,5.100.351,部屋内の敵を2秒間石化させ、アイザックの近くにいる敵を毒状態にし、アイザックの向く方向へ壁の端まで届く岩の衝撃波を起こす。,1,アクティブ,"treasure,greedTreasure,"
Glass_Cannon,Glass Cannon,ガラスの大砲,5.100.352,"敵と地形を貫通する大ダメージの弾を撃つ。
これを持っている時にダメージを受けると追加のダメージを受けたうえでアイテムがBroken Glass Cannonに変化する。",1,アクティブ,"treasure,greedTreasure,craneGame,"
Bomber_Boy,Bomber Boy,ボンバーボーイ,5.100.353,"爆弾+5個。爆破パターンが大きな十字に変化する。
これはプレイヤーがスポーンさせたトロールボムにも適用される。",2,パッシブ,"treasure,greedTreasure,bombBum,"
Crack_Jacks,Crack Jacks,クラックジャックス,5.100.354,満タンの赤ハートコンテナ1つを得て、ランダムなトリンケットをドロップする。,2,パッシブ,"boss,goldenChest,greedBoss,"
Mom%27s_Pearls,Mom's Pearls,ママのパール,5.100.355,"レンジ+2.5、ティア高度+0.5、ラック+1。
ソウルハートを1つ得る。",2,パッシブ,"boss,goldenChest,momsChest,greedBoss,oldChest,"
Car_Battery,Car Battery,車のバッテリー,5.100.356,アイザックが使用したアクティブアイテムは2回起動する。,3,パッシブ,"shop,batteryBum,greedShop,"
Box_of_Friends,Box of Friends,おともだちボックス,5.100.357,"現在の部屋のみアイザックのファミリアをすべて複製する。
アイザックがファミリアを持っていないとき、Damon Babyを直ちにスポーンする。",1,アクティブ,"shop,greedTreasure,craneGame,"
The_Wiz,The Wiz,ザ ウィズ,5.100.358,"R U a Wizard？のピル効果のように両目から同時に斜めに弾を撃つ。
アイザックの弾は地形貫通効果を得る。",1,パッシブ,"treasure,greedTreasure,"
8_Inch_Nails,8 Inch Nails,８インチ釘,5.100.359,ダメージ+1.5。アイザックの弾が釘に置き換わり、ノックバックが増加する。,3,パッシブ,"treasure,greedTreasure,"
Incubus,Incubus,インキュバス,5.100.360,"アイザックのダメージ、ティア、ティア効果に準拠した弾を撃つ悪魔のようなファミリアをスポーンする。
リリス以外のキャラクターが使用する場合、ダメージは25%に減少する。",4,パッシブ,"devil,greedDevil,babyShop,"
Fate%27s_Reward,Fate's Reward,運命からのごほうび,5.100.361,アイザックに付いてきてティア効果とダメージをコピーした弾を撃つ青い頭のファミリアをスポーンする。,2,パッシブ,"treasure,babyShop,"
Lil_Chest,Lil Chest,小さな収納箱,5.100.362,部屋のクリア時に25%の確率でランダムなピックアップを、10％の確率でランダムなトリンケットをスポーンさせる小さなチェストのファミリアをスポーンする。,2,パッシブ,"treasure,beggar,greedTreasure,craneGame,woodenChest,"
Sworn_Protector,Sworn Protector,誓約の守護者,5.100.363,"敵の弾を防ぎ秒間105ダメージを与えるオービタルファミリアをスポーンする。
1つの部屋で10発の弾を防いだ時、エターナルハートをドロップする。",3,パッシブ,"angel,greedAngel,babyShop,"
Friend_Zone,Friend Zone,トモダチゾーン,5.100.364,Distant AdmirationとForever Aloneの中間を周回し、秒間45ダメージを与える白いハエをスポーンする。,1,パッシブ,"treasure,keyMaster,greedTreasure,babyShop,"
Lost_Fly,Lost Fly,ロスト フライ,5.100.365,直線を動き最初に接触した壁か障害物を周回し、秒間105ダメージを与えるハエのファミリアをスポーンする。,1,パッシブ,"treasure,keyMaster,greedTreasure,babyShop,"
Scatter_Bombs,Scatter Bombs,拡散ボム,5.100.366,爆弾+5個。アイザックの爆弾が爆発したときに2～4個の小さな爆弾が出現する。,1,パッシブ,"treasure,greedTreasure,bombBum,"
Sticky_Bombs,Sticky Bombs,ねちょねちょボム,5.100.367,爆弾+5個。爆弾が敵に張り付き、敵を倒した時に2～4匹の青クモをスポーンする。,1,パッシブ,"treasure,greedTreasure,bombBum,"
Epiphora,Epiphora,流涙症,5.100.368,"一方向を撃ち続けていると上限値まで徐々にティアが上昇する。
撃つのをやめるか別方向を撃ち始めた時、ティアが元の数値まで戻る。",1,パッシブ,"treasure,greedTreasure,"
Continuum,Continuum,連続体,5.100.369,"地形貫通弾を得てレンジが上がる。
ティアは壁を貫通して部屋の逆サイドから出現する。",2,パッシブ,"treasure,greedTreasure,"
Mr._Dolly,Mr. Dolly,Mr. ドリー,5.100.370,ティア+0.7、レンジ+2.5、ティア高度+0.5、取得時にランダムなハートを3つスポーンする。,3,パッシブ,"boss,goldenChest,greedBoss,craneGame,"
Curse_of_the_Tower,Curse of the Tower,塔の呪い,5.100.371,ダメージを受けた時、XVI - The Towerのように部屋中に6個のトロールボムをスポーンする。,1,パッシブ,"treasure,redChest,curse,greedTreasure,greedCurse,"
Charged_Baby,Charged Baby,充電済みベイビー,5.100.372,確率で、リトルバッテリーをドロップしたり、アクティブアイテムのゲージをチャージしたり、部屋内の敵を石化させるファミリアをスポーンする。,3,パッシブ,"shop,batteryBum,greedShop,babyShop,"
Dead_Eye,Dead Eye,死者の目,5.100.373,"弾が敵に当たるたびダメージが上昇する。
ダメージは弾が外れた時にリセットされる。",3,パッシブ,"treasure,greedTreasure,ultraSecret,"
Holy_Light,Holy Light,聖なる光,5.100.374,確率で、敵に当たると周囲にダメージを与える光線を作る聖なる弾を撃つ。,3,パッシブ,"treasure,angel,greedTreasure,"
Host_Hat,Host Hat,ホスト ハット,5.100.375,"アイザックの頭上に、確率で敵の弾を防ぎ3つの弾を打ち返すホストのファミリアを生成する。
爆発無効を得る。",3,パッシブ,"treasure,greedTreasure,"
Restock,Restock,商品補充,5.100.376,"ショップで商品を購入したときに直ちに補充される。
グリードモード以外では、補充されたアイテムは購入したアイテムより高くなる。",2,パッシブ,"shop,beggar,"
Bursting_Sack,Bursting Sack,バースティングサック,5.100.377,クモ型の敵がアイザックをターゲットにせず接触ダメージを与えなくなる。,1,パッシブ,"treasure,greedTreasure,"
No._2,Number Two,ナンバー２,5.100.378,3秒間弾を撃ち続けるとアイザックが爆発時に部屋内の敵にダメージを与え混乱効果を付与するButt Bombをドロップする。,2,パッシブ,"treasure,shellGame,greedTreasure,"
Pupula_Duplex,Pupula Duplex,多瞳孔症,5.100.379,弾に地形貫通効果を与え、弾の形が広い弓なりになってサイズが大きくなる。,2,パッシブ,"treasure,greedTreasure,"
Pay_to_Play,Pay to Play,ペイ・トゥー・プレイ,5.100.380,コイン+5。開けるのに鍵を1つ必要とするドアがコイン1つで開くようになる。,2,パッシブ,"shop,greedTreasure,greedShop,"
Eden%27s_Blessing,Eden's Blessing,エデンのご加護,5.100.381,ティア+0.7。次のランのスタート時にランダムなアイテムを得る。,3,パッシブ,"treasure,"
Friendly_Ball,Friendly Ball,フレンドリーボール,5.100.382,"ボールを投げてモンスターを倒し捕獲する。
捕獲したモンスターは後に放つと友好状態となり、アイザックのために部屋を跨いで戦う。",2,アクティブ,"treasure,greedTreasure,craneGame,"
Tear_Detonator,Tear Detonator,涙デトネーター,5.100.383,使用すると画面上にあるいずれかの弾を爆発させ、Tammy's headのように周囲6方向へ弾を撃つ。,1,アクティブ,"shop,greedTreasure,craneGame,"
Lil_Gurdy,Lil Gurdy,リトル ガーディー,5.100.384,アイザックが撃っている間に溜めて、解放したときに部屋中を跳ねまわって速度に応じた接触ダメージを与えるガーディJr.のファミリアをスポーンする。,2,パッシブ,"treasure,greedTreasure,babyShop,"
Bumbo,Bumbo,バンボ,5.100.385,"近くのコインを収集して数枚のコインを得るとレベルアップする乞食のファミリアをスポーンする。
レベル2でBumboは体を得る。レベル3で弾を撃ち始める。レベル4で敵を追尾して接触ダメージを与える。",1,パッシブ,"treasure,beggar,babyShop,"
D12,D12,Ｄ１２,5.100.386,"部屋にある全ての岩と金属ブロックを爆弾岩やTNT、うんちのようなランダムな物へリロールする。
うんちとTNTはこの効果でリロールされない。",0,アクティブ,"treasure,greedShop,craneGame,"
Censer,Censer,香炉,5.100.387,内側にいる敵の弾と敵の動きを遅くする円形のオーラを作るファミリアをスポーンする。,3,パッシブ,"angel,greedAngel,"
Key_Bum,Key Bum,キー バム,5.100.388,アイザックに付いてきて鍵を収集し、お返しとしてランダムなチェストをくれるファミリアをスポーンする。,0,パッシブ,"treasure,secret,keyMaster,babyShop,"
Rune_Bag,Rune Bag,ルーン袋,5.100.389,7～8部屋クリアするごとにランダムなルーンをドロップするファミリアをスポーンする。,3,パッシブ,"treasure,secret,greedTreasure,greedSecret,"
Seraphim,Seraphim,セラフィム,5.100.390,アイザックに付いてきて10ダメージの誘導弾を75%のショットスピードで撃つ天使のファミリアをスポーンする。,3,パッシブ,"treasure,angel,greedAngel,babyShop,"
Betrayal,Betrayal,裏切り,5.100.391,アイザックがダメージを受けると敵を魅了状態にする。魅了状態は敵同士攻撃しあうようになる。,0,パッシブ,"treasure,devil,greedTreasure,greedDevil,"
Zodiac,Zodiac,ゾディアック,5.100.392,各階層でランダムな星座アイテムの効果が発動する。,1,パッシブ,"treasure,greedTreasure,"
Serpent%27s_Kiss,Serpent's Kiss,サーペントのくちづけ,5.100.393,"弾が確率で敵に毒効果を付与する。アイザックが敵に接触したときも毒を与える。
毒状態の敵が倒された時、確率で黒ハートをドロップする。",2,パッシブ,"treasure,greedTreasure,"
Marked,Marked,照準マーク,5.100.394,"アイザックは地上の赤い照準に向けて自動で弾を発射する。
照準は弾制御キーで操作する。
ティア+0.7、レンジ+3.15。",1,パッシブ,"treasure,greedTreasure,ultraSecret,"
Tech_X,Tech X,テックＸ,5.100.395,"弾が敵を貫通して通過時にダメージを与える円形のレーザーに置き換わる。
溜めることで円の大きさが大きくなる。",4,パッシブ,"treasure,greedTreasure,craneGame,"
Ventricle_Razor,Ventricle Razor,心臓メス,5.100.396,"使用するとオレンジのポータルと青のポータルを設置する。
ポータルに入るともう一方のポータルへテレポートする。",1,アクティブ,"shop,"
Tractor_Beam,Tractor Beam,トラクタービーム,5.100.397,"ティアとレンジとショットスピードが上昇する。
アイザックの顔からビームが発射され、弾はそれに追随する。",3,パッシブ,"treasure,greedTreasure,craneGame,"
God%27s_Flesh,God's Flesh,神々の肉,5.100.398,"弾が確率で敵を小さくし、アイザックから逃げる。
小さくなった敵は踏みつぶすことで倒せる。",1,パッシブ,"treasure,greedTreasure,"
Maw_of_the_Void,Maw of the Void,モー オブ ザ ボイド,5.100.399,2.35秒溜めてから離すと素早くダメージを与える黒い円をアイザックの周りに出す。,4,パッシブ,"devil,greedDevil,ultraSecret,"
Spear_of_Destiny,Spear of Destiny,因縁のスピア,5.100.400,"涙に加えてアイザックが前に槍を突き出す。
槍はダメージの2倍と同じ接触ダメージを与え、時折恐怖効果を与える。",1,パッシブ,"angel,greedAngel,"
Explosivo,Explosivo,エクスプロシボ,5.100.401,弾が確率で敵に張り付き爆発する。,2,パッシブ,"treasure,greedTreasure,"
Chaos,Chaos,カオス,5.100.402,"床に1～6個のランダムなピックアップをドロップする。
アイテムがランダムなアイテムプールから出現するようになる。",3,パッシブ,"shop,secret,greedShop,greedSecret,"
Spider_Mod,Spider Mod,スパイダーＭＯＤ,5.100.403,"アイザックが与えたダメージと敵の体力バーを表示する。
部屋内を歩き回り接触した敵へランダムなステータス異常を与えるファミリアをスポーンする。
部屋のクリア時にリトルバッテリーか青クモをスポーンする。",1,パッシブ,"shop,greedShop,craneGame,babyShop,"
Farting_Baby,Farting Baby,ファーティング ベイビー,5.100.404,"アイザックに付いてきて敵の弾を防ぐファミリアをスポーンする。
Farting Babyに敵の弾が当たったとき、確率で近くの敵に魅了と毒を与えノックバックさせるおならをする。",1,パッシブ,"treasure,babyShop,"
GB_Bug,GB Bug,ＧＢバグ,5.100.405,アイザックについてきて、発射ボタンのダブルタップで前へ発射され、最初に触れたモンスターかピックアップをリロールするファミリアをスポーンする。,1,パッシブ,"treasure,secret,greedShop,greedSecret,"
D8,D8,Ｄ８,5.100.406,アイザックのダメージとティアとレンジとスピードをリロールする。,2,アクティブ,"treasure,greedShop,craneGame,"
Purity,Purity,純潔,5.100.407,"アイザックに出るオーラの色に応じてステータスを1つ上昇させる。
ダメージを受けた時にオーラは消えて、新しい部屋に入ったときランダムな色で再生成される。
赤はダメージ、青はティア、黄はスピード、オレンジはレンジを上昇させる。",2,パッシブ,"treasure,greedTreasure,greedAngel,"
Athame,Athame,儀式の刃,5.100.408,アイザックがダメージを受けた時に周囲に黒い円が現れ、近くの敵にダメージを与える。,1,パッシブ,"devil,curse,greedCurse,greedDevil,"
Empty_Vessel,Empty Vessel,からっぽの器,5.100.409,黒ハートを2つ得る。アイザックが赤ハートを持っていないとき、飛行を得て定期的に数秒間無敵になるバリアを張る。,2,パッシブ,"devil,demonBeggar,greedDevil,"
Evil_Eye,Evil Eye,邪眼,5.100.410,"確率でアイザックと同じ方向に弾を撃つゆっくり動く目を撃つ。
目は敵か障害物に当たったときに破壊される。",2,パッシブ,"treasure,greedTreasure,"
Lusty_Blood,Lusty Blood,頑健ブラッド,5.100.411,敵を倒す度に現在の部屋でだけアイザックのダメージが上昇する。,3,パッシブ,"treasure,devil,greedTreasure,greedDevil,ultraSecret,"
Cambion_Conception,Cambion Conception,忌血の胎児,5.100.412,一定回数ダメージを受けると永続的な悪魔系ファミリアがスポーンする。,2,パッシブ,"devil,greedDevil,ultraSecret,"
Immaculate_Conception,Immaculate Conception,純血の胎児,5.100.413,一定回数ハートアイテムを取得すると、永続的な天使系ファミリアがスポーンする。,1,パッシブ,"angel,greedAngel,"
More_Options,More Options,オプションおかわり,5.100.414,"アイテム部屋に毎回2種類のアイテムがスポーンする。
片方を取ると片方は消滅する。",3,パッシブ,"shop,"
Crown_of_Light,Crown of Light,光の冠,5.100.415,"ソウルハートを2個得る。
アイザックが空の赤ハートコンテナを持っていないとき、ダメージ倍率x2、レンジ+2.5、ショットスピード-0.3。
体力に関係なく、ダメージを受けるとその部屋だけ効果が無くなる。",4,パッシブ,"angel,greedAngel,"
Deep_Pockets,Deep Pockets,深いポケット,5.100.416,"コインの取得上限が999になる。
部屋クリア報酬が何も無いとき、コインが1～3枚スポーンする。",2,パッシブ,"shop,greedTreasure,greedShop,"
Succubus,Succubus,サキュバス,5.100.417,"敵が入ると素早くダメージを与える黒いオーラと共に部屋中を跳ねまわる飛行するファミリアをスポーンする。
アイザックがオーラの中にいるとダメージ倍率x1.5。",3,パッシブ,"devil,babyShop,"
Fruit_Cake,Fruit Cake,フルーツケーキ,5.100.418,撃つごとにランダムな効果が弾に付与される。,2,パッシブ,"treasure,"
Teleport_2.0,Teleport 2.0,テレポート２．０,5.100.419,"未探索の部屋にテレポートする。
特殊部屋よりも通常部屋が優先され、レアな特殊部屋より通常の特殊部屋が優先される。",3,アクティブ,"treasure,craneGame,"
Black_Powder,Black Powder,黒い粉,5.100.420,"アイザックが通り過ぎた床上に黒い粉の跡を付ける。
円形に歩いたとき床に五芒星の印がスポーンし、中にいる敵へtickあたり10ダメージを与える。",1,パッシブ,"devil,demonBeggar,greedDevil,"
Kidney_Bean,Kidney Bean,インゲン豆,5.100.421,使用時におならをして近くの敵を魅了する。,1,アクティブ,"treasure,greedTreasure,ultraSecret,"
Glowing_Hour_Glass,Glowing Hour Glass,輝く砂時計,5.100.422,時間を巻き戻し、現在の部屋で起こったことを無かったことにしてひとつ前の部屋に戻る。,3,アクティブ,"treasure,shop,craneGame,"
Circle_of_Protection,Circle of Protection,守護の輪,5.100.423,アイザックの周りに大きくて白い輪っかを作り、内側にいる敵へ自身のダメージ分ダメージを与え、敵の弾を友好的な誘導弾へ変換する。,1,パッシブ,"angel,greedAngel,"
Sack_Head,Sack Head,フクロ頭,5.100.424,コインと爆弾と鍵とカードとルーンとバッテリーは確率で袋になる。,3,パッシブ,"shop,secret,greedSecret,"
Night_Light,Night Light,常夜灯,5.100.425,自身が動く方向へ円錐形の光を放ち、中にいる敵と敵の弾を速度低下させる。,2,パッシブ,"shop,greedTreasure,craneGame,"
Obsessed_Fan,Obsessed Fan,熱狂的ファン,5.100.426,アイザックの動いた後を付いてきて接触した敵に秒間30ダメージを与えるファミリアをスポーンする。,0,パッシブ,"treasure,keyMaster,greedTreasure,babyShop,"
Mine_Crafter,Mine Crafter,マインクラフター,5.100.427,"岩を破壊したり敵にダメージを与える、押すことで移動可能なTNTの樽を設置する。
前に設置したTNTの樽がある部屋でこのアイテムを使用したとき、前に設置したものは自動的に爆発する。",1,アクティブ,"treasure,craneGame,"
PJs,PJs,パジャマ,5.100.428,ソウルハートを4つ得て体力を全回復する。,2,パッシブ,"boss,goldenChest,greedBoss,"
Head_of_the_Keeper,Head of the Keeper,キーパーの頭,5.100.429,自身の弾がコインに変化して、敵に当たったときに確率で1コインをドロップする。,2,パッシブ,
Papa_Fly,Papa Fly,パパ　バエ,5.100.430,アイザックの動いた後を0.66秒後についてきて近くの敵を撃つファミリアをスポーンする。,1,パッシブ,"treasure,keyMaster,greedTreasure,babyShop,"
Multidimensional_Baby,Multidimensional Baby,多数次元ベイビー,5.100.431,"アイザックの動いた後を0.66秒後に付いてくるファミリアをスポーンする。
ベイビーを通過した弾は2つに増え、スピードが上昇する。",2,パッシブ,"treasure,devil,greedTreasure,greedDevil,"
Glitter_Bombs,Glitter Bombs,キラキラボム,5.100.432,"爆弾を5個得る。
爆弾は確率でランダムなピックアップを落とすか敵を魅了する。",2,パッシブ,"treasure,greedTreasure,bombBum,"
My_Shadow,My Shadow,ぼくの影,5.100.433,"自身がダメージを受けるたび、部屋中の敵に恐怖を与え黒くて友好的な敵を攻撃するチャージャーをスポーンする。
チャージャーはダメージを多く受けると倒される。",0,パッシブ,"devil,greedDevil,"
Jar_of_Flies,Jar of Flies,ハエの壺,5.100.434,"敵を倒すと瓶の中にハエが増え、最大20匹まで貯められる。
使用すると溜めた数と同じ数だけ青ハエを出す。",2,アクティブ,"shop,greedTreasure,greedShop,"
Lil_Loki,Lil Loki,リトル ロキ,5.100.435,アイザックに付いてきて十字4方向に弾を撃つロキのファミリアをスポーンする。,1,パッシブ,"treasure,ultraSecret,babyShop,"
Milk!,Milk!,ミルク！,5.100.436,"ダメージを受けた時にこぼれる、コップのファミリアをスポーンする。
牛乳がこぼれた跡、アイザックのティアディレイがその部屋だけ-2される。",1,パッシブ,"treasure,greedTreasure,"
D7,D7,Ｄ７,5.100.437,同じ敵復活させ、現在の部屋をやり直し、部屋クリア時の報酬をより獲得できる。,1,アクティブ,"treasure,craneGame,"
Binky,Binky,おしゃぶりチクビ,5.100.438,ソウルハートを1つ得て、ティア+0.75、自身のサイズが小さくなる。,3,パッシブ,"boss,goldenChest,greedBoss,craneGame,"
Mom%27s_Box,Mom's Box,ママの箱,5.100.439,"ラック+1、所持している間トリンケットの効果が2倍になる。
使用時にランダムなトリンケットを地面にドロップする。",3,アクティブ,"shop,momsChest,greedShop,craneGame,oldChest,woodenChest,"
Kidney_Stone,Kidney Stone,腎臓結石,5.100.440,"弾を撃っているとランダムに弾を撃つのをやめて赤くなり、そこで溜めた大量の「涙」を一度に放出する。
弾の放出には大ダメージを与える尿路結石が混じる。",2,パッシブ,"treasure,greedTreasure,"
Mega_Blast,Mega Blast,メガブラスト,5.100.441,"使用するとメガサタンが使うようなレーザーを撃つ。
レーザーは大ダメージを与え、部屋を跨いで15秒間放出される。
使用中はレーザーの反動で後ろへ動く力が働く。",4,アクティブ,"devil,greedDevil,"
Dark_Prince%27s_Crown,Dark Prince's Crown,ダークプリンスの冠,5.100.442,赤ハートが1つのとき、ティアとレンジとティア高度とショットスピードが増加する。,1,パッシブ,"devil,curse,greedCurse,greedDevil,"
Apple!,Apple!,アップル！,5.100.443,ティアが上昇する。確率で高いダメージのカミソリを撃つ。,3,パッシブ,"treasure,greedTreasure,ultraSecret,"
Lead_Pencil,Lead Pencil,シャープペンシル,5.100.444,弾を15発撃つたびに高いダメージの弾の集合体を撃つ。,3,パッシブ,"treasure,goldenChest,greedTreasure,craneGame,"
Dog_Tooth,Dog Tooth,イヌの歯,5.100.445,"ダメージ+0.3、スピード+0.1。
見つかっていないシークレットルームかクロールスペースのある部屋に入ったとき、短く吠えるか遠吠えをする。",1,パッシブ,"treasure,greedTreasure,"
Dead_Tooth,Dead Tooth,デッドトゥース,5.100.446,撃っている間近くの敵を毒状態にする緑のオーラを得る。,1,パッシブ,"treasure,greedTreasure,"
Linger_Bean,Linger Bean,リンガービーンズ,5.100.447,撃ち続けることでアイザックは近くにいる敵にダメージを与える弾で押せるガス状の雲を出す。,0,パッシブ,"treasure,beggar,greedTreasure,"
Shard_of_Glass,Shard of Glass,ガラスの破片,5.100.448,"ダメージを受けるとアイザックが出血状態になり、弾を撃つ方向に血しぶきが飛ぶ。
出血は最終的に自身にダメージを与えるが、赤ハートを取得することで止まる。",1,パッシブ,"treasure,greedTreasure,"
Metal_Plate,Metal Plate,メタルプレート,5.100.449,"ソウルハートを1つ得る。
敵の弾を確率で混乱弾として打ち返す。",1,パッシブ,"treasure,greedTreasure,"
Eye_of_Greed,Eye of Greed,グリードの目,5.100.450,"20発撃つごとにアイザックは1コイン失って敵を金色に石化する金の弾を追加で撃つ。
この状態で倒された敵はコインをドロップする。",2,パッシブ,"secret,greedTreasure,greedSecret,"
Tarot_Cloth,Tarot Cloth,タロットクロス,5.100.451,"ランダムなカードかルーンをドロップする。
タロット系カードの効果を2倍にする。",3,パッシブ,"shop,curse,greedShop,greedCurse,greedDevil,craneGame,"
Varicose_Veins,Varicose Veins,静脈瘤,5.100.452,ダメージを受けた時周囲10方向へ高いダメージの弾を撃つ。,2,パッシブ,"treasure,greedTreasure,ultraSecret,"
Compound_Fracture,Compound Fracture,複雑骨折,5.100.453,"レンジが上がる。
弾が敵か障害物に当たると1～3個に分裂する骨に変化する。",2,パッシブ,"treasure,greedTreasure,"
