norm_name,Item Name,アイテム名,ID,効果,クオリティ,Damage Up,Tears Up,Speed Up,Shotspeed,DLC,種類
Explosivo,Explosivo,,5.100.401,Isaac's tears have a chance to stick to enemies and explode.,2,,,,,AB,パッシブ
Farting_Baby,Farting Baby,,5.100.404,"Spawns a familiar that follows Isaac and blocks enemy shots. If a shot hits Farting Baby, it has a chance to fart, which charms, poisons, or knocks back nearby enemies.",1,,,,,AB,パッシブ
Fate%27s_Reward,Fate's Reward,,5.100.361,A blue head familiar that will follow Isaac and fire tears copying his tear effects and damage.,2,,,,,AB,パッシブ
Friend_Zone,Friend Zone,,5.100.364,"Spawns a white attack fly that orbits somewhere between Distant Admiration and Forever Alone, dealing 45 damage per second.",1,,,,,AB,パッシブ
Fruit_Cake,Fruit Cake,,5.100.418,Isaac's tears gain a random effect that changes every shot.,2,,,,,AB,パッシブ
GB_Bug,GB Bug,,5.100.405,"Spawns a familiar that bounces diagonally around the room, applying a random status effect to enemies it hits and has a chance to re-roll pickups it passes over.
Spawns a familiar that follows Isaac. Double tapping the fire button launches it forward, causing it to reroll the first monster or pickup it hits.",1,,,,,AB,パッシブ
Glitter_Bombs,Glitter Bombs,,5.100.432,+5 bombs. Bombs have a chance to drop random pickups or charm enemies when they explode.,2,,,,,AB,パッシブ
God%27s_Flesh,God's Flesh,,5.100.398,"Tears have a chance to shrink enemies, making them run away from Isaac. Shrunk enemies can be crushed and killed by walking over them.",1,,,,,AB,パッシブ
Head_of_the_Keeper,Head of the Keeper,,5.100.429,Isaac's tears become coins and now have a chance to drop Pennies on the floor upon successfully hitting an enemy.,2,,,,,AB,パッシブ
Holy_Light,Holy Light,,5.100.374,"Adds a chance to fire holy tears, which will create a damaging light beam in the area if they hit an enemy.",3,,,,,AB,パッシブ
Host_Hat,Host Hat,,5.100.375,A host familiar that sits on Isaac's head and has a random chance to block enemy shots and retaliate with 3 tears. Grants immunity to explosions.,3,,,,,AB,パッシブ
Immaculate_Conception,Immaculate Conception,,5.100.413,"Upon picking up a certain amount of health, spawn a permanent angelic familiar.",1,,,,,AB,パッシブ
Incubus,Incubus,,5.100.360,"Spawns a demonic familiar that shoots tears identical to Isaac's in terms of damage, tears, and tear effects.",4,,,,,AB,パッシブ
Key_Bum,Key Bum,,5.100.388,"Spawns a familiar that follows Isaac and collects Keys for himself, giving random Chests in return.",0,,,,,AB,パッシブ
Kidney_Stone,Kidney Stone,,5.100.440,"Randomly while firing tears, Isaac will stop firing and turn red, where he will charge and release a lot of 'tears' in one go. The burst of tears also includes a kidney stone, which deals a lot of damage.",2,,-0.2,,,AB,パッシブ
Lil_Chest,Lil Chest,,5.100.362,Spawns a chest familiar that spawns a random pickup (25% chance) or trinket (10% chance) upon clearing a room.,2,,,,,AB,パッシブ
Lil_Gurdy,Lil Gurdy,,5.100.384,"A Gurdy Jr. familiar that charges up while Isaac is firing, bouncing around the room when released and dealing contact damage based on its speed.",2,,,,,AB,パッシブ
Lil_Loki,Lil Loki,,5.100.435,Spawns a Loki familiar that follows Isaac and fires 4 tears in a cross pattern.,1,,,,,AB,パッシブ
Lost_Fly,Lost Fly,,5.100.365,"Spawns fly familiar that moves in a straight line and circles around the first wall or obstacle it hits, dealing 105 damage per second on contact.",1,,,,,AB,パッシブ
Lusty_Blood,Lusty Blood,,5.100.411,Isaac's damage increases for the current room each time he kills an enemy.,3,,,,,AB,パッシブ
Marked,Marked,,5.100.394,"Isaac will automatically fire tears directed at a red target on the ground. The target can be moved with tear controls. +0.7 tears, +3.15 range.",1,,,+0.7,,AB,パッシブ
Maw_of_the_Void,Maw of the Void,,5.100.399,"Charged by firing for 2.5 seconds and when released, creates a black ring around Isaac that rapidly deals damage. +1 damage, the ring can cause enemies to drop Black Hearts.",4,+1.0,,,,AB,パッシブ
Milk!,Milk!,,5.100.436,"Spawns a glass familiar that spills on the floor upon taking damage. After the milk spills, Isaac's tear delay is decreased by 2 for the current room.",1,,,,,AB,パッシブ
Mom%27s_Pearls,Mom's Pearls,,5.100.355,"+1.25 range, +0.5 tear height, +1 luck. Grants one Soul Heart.",2,,,,,AB,パッシブ
More_Options,More Options,,5.100.414,Two items spawn in every Treasure Room. Only one can be taken; the other will disappear.,3,,,,,AB,パッシブ
Mr._Dolly,Mr. Dolly,,5.100.370,"+0.7 tears, +5.25 range, +0.5 tear height, spawns 3 random types of Hearts on the floor when picked up.",3,,,+0.7,,AB,パッシブ
Multidimensional_Baby,Multidimensional Baby,,5.100.431,Spawns a familiar that will follow Isaac's movements on a 2.5-second delay. Tears that pass through the baby will be doubled and increase in speed.,2,,,,+4,AB,パッシブ
My_Shadow,My Shadow,,5.100.433,"Each time Isaac takes damage, inflicts fear on all enemies in the room and spawns a black friendly Charger that will attack enemies. The Charger will be killed if it is damaged too much.",0,,,,,AB,パッシブ
Night_Light,Night Light,,5.100.425,A cone of light shines in the direction Isaac is moving that slows enemies and enemy shots.,2,,,,,AB,パッシブ
No._2,Number Two,,5.100.378,"Continuously firing tears for three seconds causes Isaac to drop a Butt Bomb, which damages and confuses all enemies in the room when it explodes.",2,,,,,AB,パッシブ
Obsessed_Fan,Obsessed Fan,,5.100.426,Spawns a familiar that follows Isaac's movements on a delay and deals 30 contact damage per second to enemies.,0,,,,,AB,パッシブ
Papa_Fly,Papa Fly,,5.100.430,"Spawns a familiar that follows Isaac's movements on a 3 second delay, firing tears at nearby enemies.",1,,,,,AB,パッシブ
Pay_to_Play,Pay to Play,,5.100.380,+5 coins. Turns doors that require a single Key into doors which need a coin to enter instead.,2,,,,,AB,パッシブ
PJs,PJs,,5.100.428,Grants 4 Soul Hearts and fully restores Isaac's health.,2,,,,,AB,パッシブ
Pupula_Duplex,Pupula Duplex,,5.100.379,"Gives Isaac spectral tears and gives his tears a wide arc shape, increasing their size.",2,,,,,AB,パッシブ
Purity,Purity,,5.100.407,"Boosts one of Isaac's stats depending on the color of the aura around him. The aura disappears upon taking damage and reappears with a random color upon entering a new room. Red boosts damage, blue boosts tears, yellow boosts speed, and orange boosts range.",2,+4,+0.5,,,AB,パッシブ
Restock,Restock,,5.100.376,"Causes shops to instantly restock their items when they are bought. Outside of Greed Mode, the restocked item's cost is increased after each purchase.",2,,,,,AB,パッシブ
Rune_Bag,Rune Bag,,5.100.389,Spawns a familiar that drops a random rune every 5-6 ( 7-8) rooms.,3,,,,,AB,パッシブ
Sack_Head,Sack Head,,5.100.424,"Coins, bombs, keys, cards, runes and batteries have a chance to become sacks.",3,,,,,AB,パッシブ
Scatter_Bombs,Scatter Bombs,,5.100.366,Adds 5 bombs. Isaac's bombs explode into 2-4 tiny bombs.,1,,,,,AB,パッシブ
Seraphim,Seraphim,,5.100.390,Spawns an angel familiar which follows Isaac and fires homing tears which deal 10 damage and have 75% shot speed.,3,,,,,AB,パッシブ
Serpent%27s_Kiss,Serpent's Kiss,,5.100.393,Tears have a chance to apply a poison effect to enemies. Isaac poisons enemies on contact. Poisoned enemies have a chance to drop a black heart when killed.,2,,,,,AB,パッシブ
Spear_of_Destiny,Spear of Destiny,,5.100.400,"In addition to tears, Isaac holds a spear in front of him which deals contact damage equal to 2x his tear damage, and occasionally inflicts fear.",1,,,,,AB,パッシブ
Spider_Mod,Spider Mod,,5.100.403,Displays Isaac's tear damage and enemy health bars. Spawns a familiar that wanders around and inflicts random status effects on enemies it touches. Can spawn a Lil' Battery/Blue spider upon clearing a room.,1,,,,,AB,パッシブ
Sticky_Bombs,Sticky Bombs,,5.100.367,+5 bombs. Bombs stick to enemies and spawn 2-4 Blue Spiders if they kill an enemy.,1,,,,,AB,パッシブ
Succubus,Succubus,,5.100.417,"Spawns a flying familiar that bounces around the room with a black aura, dealing rapid damage to any enemies inside it. While standing in the aura, Isaac gains a 1.5x tear damage multiplier.",3,-10,,,,AB,パッシブ
Sworn_Protector,Sworn Protector,,5.100.363,"Spawns an orbital familiar which does 105 damage per second and attracts and blocks enemy shots. Upon blocking 10 shots in a room, it drops an Eternal Heart.",3,,,,,AB,パッシブ
Tech_X,Tech X,,5.100.395,Tears are replaced with laser rings that pierce through enemies and deal damage to enemies within them. Can be charged to increase the effectiveness of the ring.,4,,,,,AB,パッシブ
The_Wiz,The Wiz,,5.100.358,"Tears simultaneously fire out of both eyes diagonally, similar to the effect of the R U a Wizard? pill. Isaac's tears also travel above all obstacles.",1,,,,,AB,パッシブ
Toxic_Shock,Toxic Shock,,5.100.350,"Upon entering a room, poisons all enemies, dealing double Isaac's tear damage. Killing enemies leaves a small, short-lasting pool of green creep on the ground.",3,,,,,AB,パッシブ
Tractor_Beam,Tractor Beam,,5.100.397,"Increases Tears, Range, and Shot Speed. Isaac emits a beam from his face that his tears are bound to.",3,,,+0.5,+0.16,AB,パッシブ
Zodiac,Zodiac,,5.100.392,Gives Isaac a random zodiac item effect that changes every floor.,1,,,,,AB,パッシブ
7_Seals,7 Seals,,5.100.526,Spawns a random Harbinger familiar that changes every 10 seconds. Harbingers have different behaviors and spawn themed Locusts.,2,,,,,AB+,パッシブ
Acid_Baby,Acid Baby,,5.100.491,"Spawns a familiar that drops a random pill every 3 rooms. Upon using a pill, all enemies in the room are poisoned.",2,,,,,AB+,パッシブ
Adrenaline,Adrenaline,,5.100.493,Increases damage based on how many empty Red Heart containers Isaac has.,1,,,,,AB+,パッシブ
Analog_Stick,Analog Stick,,5.100.465,+0.35 tears up. Allows Isaac to fire tears diagonally.,2,,,+0.35,,AB+,パッシブ
Angelic_Prism,Angelic Prism,,5.100.528,Spawns an orbital familiar with a large orbital radius. Tears that pass through the prism split into four multi-colored tears.,3,,,,,AB+,パッシブ
Angry_Fly,Angry Fly,,5.100.511,Spawns a fly familiar that orbits around a random enemy and deals 30 damage per second to enemies it comes in contact with.,1,,,,,AB+,パッシブ
Apple!,Apple!,,5.100.443,Increases tears. Adds a chance to fire a high-damage razor blade.,3,,,+0.3,,AB+,パッシブ
Backstabber,Backstabber,,5.100.506,Isaac's tears deal double damage and inflict bleeding on enemies if they're facing away from Isaac.,1,,,,,AB+,パッシブ
Belly_Button,Belly Button,,5.100.458,Drops a random trinket. Grants a second trinket slot.,3,,,,,AB+,パッシブ
Big_Chubby,Big Chubby,,5.100.473,"Spawns a familiar that follows Isaac and charges across the room when Isaac fires, blocking shots and dealing 40.5 damage per second on contact.",1,,,,,AB+,パッシブ
Blanket,Blanket,,5.100.535,"Grants one Soul Heart. Upon entering a boss room, grants a shield that blocks one hit, then disappears.",2,,,,,AB+,パッシブ
Bloodshot_Eye,Bloodshot Eye,,5.100.509,Spawns an orbital familiar that deals 30 damage per second and fires a randomly angled tear every 2 seconds.,1,,,,,AB+,パッシブ
Bozo,Bozo,,5.100.513,"+0.1 flat damage, grants a Soul Heart. Enemies can randomly become briefly charmed or feared. Taking damage has a chance to spawn a rainbow poop.",2,,,,,AB+,パッシブ
Brittle_Bones,Brittle Bones,,5.100.549,"Replaces all Red Hearts with 6 empty Bone Hearts. Upon losing a Bone Heart, Isaac fires bones in 8 directions and permanently gains a tears up.",3,,,+0.5,,AB+,パッシブ
Broken_Modem,Broken Modem,,5.100.514,"Enemies, enemy shots, tears, and pickups will briefly freeze in place at random intervals.",2,,,,,AB+,パッシブ
Broken_Shovel,Broken Shovel,,5.100.551,One of two parts necessary to create Mom's Shovel. No effect if somehow obtained on its own.,4,,,,,AB+,パッシブ
Buddy_in_a_Box,Buddy in a Box,,5.100.518,Spawns a familiar with a random tear effect. The familiar is randomized at the start of each floor.,2,,,,,AB+,パッシブ
Camo_Undies,Camo Undies,,5.100.497,"Isaac becomes camouflaged at the beginning of each room. Until he shoots, all non-boss enemies will be confused.",0,,,,,AB+,パッシブ
Compound_Fracture,Compound Fracture,,5.100.453,"Increases range. Tears turn into bones, which shatter into 1-3 bone shards upon hitting an enemy or obstacle.",2,,,,,AB+,パッシブ
Cone_Head,Cone Head,,5.100.457,Grants a Soul Heart. Gives Isaac a chance to ignore any damage taken.,2,,,,,AB+,パッシブ
Contagion,Contagion,,5.100.466,The first enemy killed in a room explodes and poisons nearby enemies. Poisoned enemies will also explode upon death.,2,,,,,AB+,パッシブ
Dad%27s_Lost_Coin,Dad's Lost Coin,,5.100.455,+1.5 range. Drops a Lucky Penny.,2,,,,,AB+,パッシブ
Dad%27s_Ring,Dad's Ring,,5.100.546,Creates a ring of light around Isaac that petrifies enemies in contact.,3,,,,,AB+,パッシブ
Dark_Prince%27s_Crown,Dark Prince's Crown,,5.100.442,"When at exactly one Red Heart, increases tears, range, tear height, and shot speed.",1,,,+0.75,+0.2,AB+,パッシブ
Dead_Tooth,Dead Tooth,,5.100.446,"While firing, Isaac gains a green aura that poisons nearby enemies.",1,,,,,AB+,パッシブ
Death%27s_List,Death's List,,5.100.530,Grants a pickup or stat upgrade if all enemies in a room are killed in the order they are marked.,2,,+0.2,+0.5,+0.2,AB+,パッシブ
Depression,Depression,,5.100.469,Spawns a familiar that leaves a trail of creep that damages enemies at 6 damage per second. Has a chance to spawn damaging beams of light onto enemies that touch the cloud.,1,,,,,AB+,パッシブ
Divorce_Papers,Divorce Papers,,5.100.547,"Grants one Bone Heart, +0.7 tears, spawns a Mysterious Paper.",3,,,+0.7,,AB+,パッシブ
Dog_Tooth,Dog Tooth,,5.100.445,"+0.3 damage, +0.1 speed. Plays a howl or bark sound when entering a room with undiscovered Secret Rooms or Crawl Spaces.",1,+0.3,+0.1,,,AB+,パッシブ
Duality,Duality,,5.100.498,"Whenever a Devil or Angel Room would spawn after defeating a boss, both rooms spawn. Only one can be entered.",1,,,,,AB+,パッシブ
Eucharist,Eucharist,,5.100.499,"An Angel Room door will always spawn after every boss fight, excluding the first floor and floors after Womb II/ Utero II/.",3,,,,,AB+,パッシブ
Euthanasia,Euthanasia,,5.100.496,"Adds a chance to fire needles that instantly kill basic enemies and deal triple damage to bosses. If a needle kills an enemy, it bursts into more tears/needles.",3,,,,,AB+,パッシブ
Eye_of_Belial,Eye of Belial,,5.100.462,"Grants piercing tears. After piercing one enemy, tears start homing and deal double damage.",3,,,,,AB+,パッシブ
Eye_of_Greed,Eye of Greed,,5.100.450,"Every 20 tears, Isaac loses 1 coin and shoots an additional gold tear that petrifies enemies and turns them into gold. Any enemy killed while in this state will drop coins.",2,,,,,AB+,パッシブ
Fast_Bombs,Fast Bombs,,5.100.517,Grants 7 bombs and allows bombs to be placed rapidly.,1,,,,,AB+,パッシブ
Finger!,Finger!,,5.100.467,"Spawns a finger familiar that points at enemies, dealing scaling damage.",1,,,,,AB+,パッシブ
Flat_Stone,Flat Stone,,5.100.540,"Tears bounce off the floor, creating splashes. Splashes deal 25% of Isaac's tear damage to all enemies in a small area.",2,,,,,AB+,パッシブ
Ghost_Pepper,Ghost Pepper,,5.100.495,"Gives a chance to shoot fires alongside tears that block enemy shots and deal damage to enemies that touch them.
Gives a chance to shoot blue fires alongside tears that become smaller as they travel.",3,,,,,AB+,パッシブ
Glaucoma,Glaucoma,,5.100.460,Adds a chance to shoot tears that confuse enemies for an extremely long time.,2,,,,,AB+,パッシブ
Glyph_of_Balance,Glyph of Balance,,5.100.464,Grants 2 Soul Hearts and modifies drops from Champion monsters based on certain conditions. Also modifies room clear drops.,2,,,,,AB+,パッシブ
Greed%27s_Gullet,Greed's Gullet,,5.100.501,Grants a Red Heart container for every 25 coins Isaac has.,1,,,,,AB+,パッシブ
Haemolacria,Haemolacria,,5.100.531,"Tears are now fired in an arc. Upon hitting the floor, an obstacle, or an enemy, they burst into many smaller tears in all directions. Increases tear delay.",3,+1,,,,AB+,パッシブ
Hallowed_Ground,Hallowed Ground,,5.100.543,"Spawns a white poop familiar, which turns into a white poop when Isaac is hurt. White poop has an aura that increases tear fire rate and can block enemy shots.",1,,,,,AB+,パッシブ
Hushy,Hushy,,5.100.470,"Spawns a Hush familiar that bounces diagonally around the room and deals contact damage. While firing tears, it stops moving.",0,,,,,AB+,パッシブ
Jacob%27s_Ladder,Jacob's Ladder,,5.100.494,Tears fire sparks of electricity in random directions upon hitting an obstacle or enemy.,3,,,,,AB+,パッシブ
Jaw_Bone,Jaw Bone,,5.100.548,"Spawns a familiar that flies through the room while firing, dealing a flat 7 contact damage to enemies and retrieving pickups.",1,,,,,AB+,パッシブ
Jumper_Cables,Jumper Cables,,5.100.520,Grants an active item charge every 15 enemies killed.,3,,,,,AB+,パッシブ
King_Baby,King Baby,,5.100.472,"Spawns a familiar that follows Isaac and makes other familiars follow it. While firing tears, other familiars stop moving.",1,,,,,AB+,パッシブ
Lachryphagy,Lachryphagy,,5.100.532,"Isaac's tears decelerate as they travel. Upon stopping or hitting an obstacle, they burst into 8 tears in all directions. Tears can be fired into other tears to feed them, increasing their damage.",2,,,,,AB+,パッシブ
Large_Zit,Large Zit,,5.100.502,Adds a chance to fire a creep shot that deals double damage and leaves a trail of slowing white creep.,1,,,,,AB+,パッシブ
Lead_Pencil,Lead Pencil,,5.100.444,"After every 15 tears fired, Isaac will fire a high-damage cluster of tears.",3,,,,,AB+,パッシブ
Leprosy,Leprosy,,5.100.525,"Upon taking damage, grants a body part as an orbital, which blocks enemy shots and deals 7 damage per tick to enemies it comes in contact with. The orbitals will be destroyed if they take enough damage from enemies or enemy shots.",1,,,,,AB+,パッシブ
Lil_Delirium,Lil Delirium,,5.100.519,Grants a familiar that transforms into another random familiar every 10 seconds.,2,,,,,AB+,パッシブ
Lil_Monstro,Lil Monstro,,5.100.471,Spawns a familiar that fires clusters of tears. Must be charged before shooting.,2,,,,,AB+,パッシブ
Lil_Spewer,Lil Spewer,,5.100.537,"Drops a random pill, and spawns a familiar that charges up and fires creep. Using pills changes the creep type.",1,-47,,,,AB+,パッシブ
Linger_Bean,Linger Bean,,5.100.447,Constantly shooting causes Isaac to release gas clouds that can be pushed by his tears and damage nearby enemies.,0,,,,,AB+,パッシブ
Little_Horn_(Item),Little Horn,,5.100.503,"Adds a chance to fire a piercing tear that instantly kills any enemy that it touches.
Adds a chance to fire a tear that summons Big Horn's hand to crush the first enemy it hits, instantly killing monsters or greatly damaging bosses.",3,,,,,AB+,パッシブ
Marbles,Marbles,,5.100.538,"Spawns 3 random trinkets, 5% chance to swallow held trinket after taking damage, gaining its effect permanently.",2,,,,,AB+,パッシブ
Marrow,Marrow,,5.100.541,Grants one Bone Heart and spawns three Red Hearts.,1,,,,,AB+,パッシブ
Metal_Plate,Metal Plate,,5.100.449,Grants one Soul Heart. Enemy shots have a chance to be reflected at the shooter as confusing tears.,1,,,,,AB+,パッシブ
Midnight_Snack,Midnight Snack,,5.100.456,Grants one full Red Heart container. Heals 1 additional Red Heart.,1,,,,,AB+,パッシブ
Mom%27s_Razor,Mom's Razor,,5.100.508,"Spawns an orbiting razor that deals contact damage and inflicts bleeding on enemies, causing them to slowly take damage over time.",1,,,,,AB+,パッシブ
Mystery_Egg,Mystery Egg,,5.100.539,"Spawns an egg familiar, which cracks into a random friendly monster when Isaac is hurt. The egg regenerates upon entering a different room.",1,,,,,AB+,パッシブ
Parasitoid,Parasitoid,,5.100.461,Adds a chance to fire an egg sack which creates slowing creep and spawns a Blue Fly or Blue Spider upon hitting an enemy.,3,,,,,AB+,パッシブ
Pointy_Rib,Pointy Rib,,5.100.544,"Spawns a bone familiar that hovers back and forth in front of Isaac, dealing damage equal to Isaac's damage.",2,,,,,AB+,パッシブ
Poke_Go,Poke Go,,5.100.505,"Upon entering a room with enemies in it, has a chance to spawn a random friendly enemy that persists across rooms.",1,,,,,AB+,パッシブ
Polydactyly,Polydactyly,,5.100.454,"Allows Isaac to carry two cards, pills, or any combination of both. Spawns one random card, rune, or pill.",2,,,,,AB+,パッシブ
Pop!,Pop!,,5.100.529,"Replaces Isaac's tears with eyeballs that can bounce off of each other. The eyeballs are not limited by range, and will instead dissipate when they stop moving or when hitting an enemy or obstacle.",2,,,,,AB+,パッシブ
Sack_of_Sacks,Sack of Sacks,,5.100.500,Spawns a familiar that drops a sack every 5-6 rooms cleared.,3,,,,,AB+,パッシブ
Schoolbag,Schoolbag,,5.100.534,Allows Isaac to hold two active items.,3,,,,,AB+,パッシブ
Shade,Shade,,5.100.468,"Spawns a shadow familiar that follows Isaac's movements on a 1 second delay and deals contact damage to enemies. After dealing enough damage, it is absorbed by Isaac and spawns friendly Chargers.",0,,,,,AB+,パッシブ
Shard_of_Glass,Shard of Glass,,5.100.448,"Upon taking damage, Isaac has a chance to drop a full red heart, gain 5 range, and leave a trail of damaging red creep for the current room.
Taking damage causes Isaac to bleed, spraying a volley of blood in the direction he fires. Bleeding will eventually damage him, but it can be stopped by picking up a Red Heart.",1,,,,,AB+,パッシブ
Sinus_Infection,Sinus Infection,,5.100.459,Adds a chance to fire a booger that sticks to enemies and deals damage over time.,3,,,,,AB+,パッシブ
Slipped_Rib,Slipped Rib,,5.100.542,Spawns a bone familiar that circles around Isaac and reflects enemy shots.,2,,,,,AB+,パッシブ
Sulfuric_Acid,Sulfuric Acid,,5.100.463,+0.3 damage. Adds a chance to fire acidic tears which can destroy obstacles.,2,+0.3,,,,AB+,パッシブ
Tarot_Cloth,Tarot Cloth,,5.100.451,Drops a random card or rune. Doubles the effects of most cards and runes. Doubles the effects of tarot cards.,3,,,,,AB+,パッシブ
Technology_Zero,Technology Zero,,5.100.524,Connects Isaac's tears with electricity that can damage enemies.,3,,,,,AB+,パッシブ
Trisagion,Trisagion,,5.100.533,Damage down. Tears are replaced with piercing white blasts of light that can damage the same enemy multiple times.,2,,,,,AB+,パッシブ
Varicose_Veins,Varicose Veins,,5.100.452,Taking damage releases a ring of 10 high damage tears.,2,+25,,,,AB+,パッシブ
YO_LISTEN!,YO LISTEN!,,5.100.492,"+1 luck. Spawns a fairy familiar that points out Secret Rooms, Crawl Space entrances, and tinted rocks.",2,,,,,AB+,パッシブ
120_Volt,120 Volt,,5.100.559,Repeatedly zaps enemies that are close to Isaac.,2,,,,,Repentance,パッシブ
2Spooky,2Spooky,,5.100.554,Enemies near Isaac are afflicted with fear.,2,,,,,Repentance,パッシブ
4.5_Volt,4.5 Volt,,5.100.647,"Active items don't charge when clearing rooms. Instead, they're charged by dealing damage to enemies.",2,,,,,Repentance,パッシブ
A_Bar_of_Soap,A Bar of Soap,,5.100.564,Gives Isaac +0.5 Tears and +0.2 Shot Speed.,3,,,+0.5,+0.2,Repentance,パッシブ
A_Pound_of_Flesh,A Pound of Flesh,,5.100.672,"Devil deals now cost coins, Shop items now cost health, and consumables in shops are free but surrounded by spikes.",1,,,,,Repentance,パッシブ
Act_of_Contrition,Act of Contrition,,5.100.601,Increases tears and grants an Eternal Heart. Allows Angel Rooms to appear even if a Devil Deal has been taken before. Greatly boosts Devil/Angel Deal chance if Isaac has taken Red Heart damage.,3,,,+0.7,,Repentance,パッシブ
Akeldama,Akeldama,,5.100.641,"While in an uncleared room, Isaac forms a trail of bloody tears that drags behind him, bursting and dealing damage upon contact with enemies.",2,,,,,Repentance,パッシブ
Almond_Milk,Almond Milk,,5.100.561,"Quadruples fire rate, with x0.3 damage multiplier. Tears are given random worm trinket effects.",1,,,,,Repentance,パッシブ
Astral_Projection,Astral Projection,,5.100.677,"Causes Isaac to turn into a ghost if he gets hit while in an uncleared room, giving him flight and spectral tears and blocking the next hit he takes.",2,,,,,Repentance,パッシブ
Azazel%27s_Rage,Azazel's Rage,,5.100.699,"Isaac builds rage every time a room is cleared. After four rooms, fires a large Brimstone laser when entering the next room.",3,,,,,Repentance,パッシブ
Battery_Pack,Battery Pack,,5.100.603,Recharges Isaac's currently held active item and drops 2-4 batteries.,1,,,,,Repentance,パッシブ
Belly_Jelly,Belly Jelly,,5.100.690,"Causes enemies to bounce off of Isaac, dealing damage to them if they hit an enemy or obstacle. Also gives Isaac the chance to deflect enemy shots.",3,,,,,Repentance,パッシブ
Binge_Eater,Binge Eater,,5.100.664,"+1 Red Heart Container and fully heals Isaac. Item pedestals cycle between their initial item and one of several food items, and picking up food items grants a temporary damage boost and a permanent boost to 2 stats (different for each one) in addition to their normal effects. Food items will also heal 2 additional Red Hearts when picked up.",4,+3.6,-0.03,,,Repentance,パッシブ
